name;short_text;prob2_0
Giperboloid_inzhenera_Garina_19;"В дождливый воскресный вечер начала весны огни из окон и бесчисленные огни фонарей отражались в асфальтах парижских улиц.
Будто по черным каналам, над";0.00026579882638222115
Giperboloid_inzhenera_Garina_20;После этого вечера прошло семь недель. Двойник Гарина был убит на Крестовском острове. Семенов явился на бульвар Мальзерб без чертежей и аппарата. Рол;0.0014829033275607722
Giperboloid_inzhenera_Garina_40;"Бросив Семенова в морге, Роллинг проехал на улицу Сены. Там все оставалось по-прежнему – тихая паника. Зоя не появлялась и не звонила.
Роллинг заперся";0.0004358016047496694
Giperboloid_inzhenera_Garina_87;Грозовые тучи утонули на северо-востоке. Синий океан был необъятно ласков. Мягкие гребни волн сверкали стеклом. Гнались дельфины за водяным следом яхт;0.006801990736851701
Giperboloid_inzhenera_Garina_66;Полная луна взошла перед рассветом. То, что казалось неясным нагромождением камней и скал, отчетливо выступало в лунном свете, легли бархатные тени от;0.0007051644854060764
Giperboloid_inzhenera_Garina_73;Вольф не совсем был неправ, когда уверял, что у Гарина брызнули осколки черепа. Когда Гарин, на секунду замолчав перед микрофоном, потянулся за сигаро;0.0023292236361095904
Giperboloid_inzhenera_Garina_85;Океан был неспокоен. «Аризона» шла под парусами. Были поставлены гроты и кливера, – все паруса, кроме марселей. Узкий корпус яхты, – скорлупка с парус;0.00038001286712251755
Giperboloid_inzhenera_Garina_63;"– Ваше имя, фамилия?
– Ротмистр Кульневского полка Александр Иванович Волшин, – ответил широкоскулый офицер, вытягиваясь перед Гариным.
– На какие сре";0.04648174833808556
Giperboloid_inzhenera_Garina_103;В двадцать третьем часу с флагманского линейного корабля эскадры североамериканского флота было замечено постороннее тело над созвездием Южного Креста;0.0008811958694636853
Giperboloid_inzhenera_Garina_70;Весь остальной день Вольф и Хлынов провели в К. Бродили по улицам, болтали о разных пустяках с местными жителями, выдавая себя за туристов. Когда горо;0.0017507006217606792
Giperboloid_inzhenera_Garina_94;Гарин послал в газеты Старого и Нового Света радио о том, что им, Пьером Гарри, занят в Тихом океане, под сто тридцатым градусом западной долготы и дв;0.0004955939384346097
Giperboloid_inzhenera_Garina_30;Через десять минут Гарин выскочил из автомобиля на бульваре Сен-Мишель. Зеркальные окна в кафе «Пантеон» были подняты. В глубине за столиком сидел Вик;0.0012773901871865325
Giperboloid_inzhenera_Garina_71;Небольшой и плотный человек с полуседыми волосами, приглаженными на гладкий пробор, в голубых очках, прикрывающих больные глаза, стоял у изразцовой пе;0.007484822862387974
Giperboloid_inzhenera_Garina_129;Утренняя заря взошла на безоблачное небо. Розовым паром дымился океан. Гарин, перегнувшись в окно гондолы дирижабля, с трудом в бинокль разыскал глубо;0.003719216423218096
Giperboloid_inzhenera_Garina_59;"– Есть новости?
– Да. Здравствуйте, Вольф.
– Я прямо с вокзала, голоден, как в восемнадцатом году.
– У вас веселый вид, Вольф. Много узнали?
– Кое-что";0.000622054526129196
Giperboloid_inzhenera_Garina_84;В ближайшие дни произошло следующее: «Аризона» бросила якорь на внешнем рейде в Марселе. Гарин предъявил в банке Лионского кредита чек Роллинга на два;0.00039391352278220475
Giperboloid_inzhenera_Garina_60;Трещал хворост в очаге, прокопченном за два столетия, с огромными ржавыми крючьями для колбас и окороков, с двумя каменными святыми по бокам, – на одн;0.005673372240693857
Giperboloid_inzhenera_Garina_8;"На улице близ почтамта к Шельге подбежал дежурный агент – весь красный, в пятнах:
– Товарищ Шельга, он ушел.
– Зачем же вы его упустили?
– Его автомоб";0.0010512661783327838
Giperboloid_inzhenera_Garina_57;Но на борту «Аризоны» происходило не совсем то, о чем думал Роллинг. Он помнил Зою умной, спокойно-расчетливой, холодной, преданной. Он знал, с какой ;0.00048397395875759925
Giperboloid_inzhenera_Garina_42;Ночь была сыроватая и теплая. За открытым окном, от низкого потолка до самого пола, невидимые листья принимались шелестеть и затихали. В комнате – во ;0.0012090496147116197
Giperboloid_inzhenera_Garina_67;В восьмом часу утра Вольф и Хлынов пили молоко на деревянной веранде ресторана «К прикованному скелету». Ночные поиски были безуспешны. Сидели молча, ;0.001168378897962113
Giperboloid_inzhenera_Garina_9;Подходя к уголовному розыску, Шельга сразу остановился, – будто налетел на телеграфный столб. «Хе! – выдохнул он, – хе! – и бешено топнул ногой: – Ах,;0.005955331615708465
Giperboloid_inzhenera_Garina_118;Незадолго до открытия Вашингтонской конференции в гавань Сан-Франциско вошли пять океанских кораблей. Они мирно подняли голландский флаг и ошвартовали;0.00017820392872991577
Giperboloid_inzhenera_Garina_35;Шельга хорошо помнил «проигранную пешку» на даче на Крестовском. Тогда (на бульваре Профсоюзов) он понял, что Пьянков-Питкевич непременно придет еще р;0.0005042534275228305
Giperboloid_inzhenera_Garina_18;Зоя Монроз поддерживала связи с некоторыми из русских эмигрантов. Один из них, Семенов, состоял у нее на постоянном жалованье. Он был инженером-химико;0.0006229475711468268
Giperboloid_inzhenera_Garina_119;«Аризона» только что вернулась в гавань Золотого острова. Янсен докладывал мадам Ламоль о положении вещей на континенте. Зоя была еще в постели, среди;0.00047457052444755196
Giperboloid_inzhenera_Garina_88;В далеких перспективах Васильевского острова пылал осенний закат. Багровым и мрачным светом были озарены баржи с дровами, буксиры, лодки рыбаков, дымы;0.001124604361470059
Giperboloid_inzhenera_Garina_56;После убийств в Вилль-Давре и Фонтенебло и затем бешеной езды с Гариным по залитым лунным светом пустынным шоссейным дорогам в Гавр Зоя и Роллинг боль;0.000720851178119726
Giperboloid_inzhenera_Garina_62;Шельга лежал на каменном полу на матраце. Керосиновая коптилка освещала сводчатый погреб, пустые бочки, заросли паутины. Гарин некоторое время искал г;0.0006805227132166891
Giperboloid_inzhenera_Garina_99;Верхние края шахты были одеты стальной броней. Массивные цилиндры из тугоплавкой стали опускались в нее по мере ее углубления. Они доходили до того ме;0.0021342545205129465
Giperboloid_inzhenera_Garina_64;Прошло пять дней. Ничто не нарушало покоя прирейнского небольшого городка К., лежащего в зеленой и влажной долине вблизи знаменитых заводов Анилиновой;0.0006182342284283258
Giperboloid_inzhenera_Garina_22;Белый, хрустальный, сияющий поезд линии Норд-Зюйд – подземной дороги – мчался с тихим грохотом по темным подземельям под Парижем. В загибающихся тунне;0.0007543935416263419
Giperboloid_inzhenera_Garina_79;"– Извозчик, гони, гони вовсю… Я слушаю, мадам Ламоль… Итак… Покуда я ждал в курительной…
– Я поднялась к себе. Сняла шляпу и плащ…
– Знаю.
– Откуда?
Р";0.002195913785577281
Giperboloid_inzhenera_Garina_69;"Роллинг взял телефонную трубку:
– Да.
– Говорит Семенов. Только что перехвачено радио Гарина. Разрешите прочесть?..
– Да.
– «Будет все так, как ты хоч";0.015886908795399533
Giperboloid_inzhenera_Garina_89;"Иван Гусев жил у Тарашкина, был ему не то сыном, не то младшим братом. Тарашкин учил его грамоте и уму-разуму.
Мальчишка оказался до того понятливый, ";0.011238082754509203
Giperboloid_inzhenera_Garina_93;Весь этот день дул северный ветер, ползли тучи низко над лесом. Печально шумели высокие сосны, гнулись темные вершины кедров, облетали лиственницы. Сы;0.0006177567270404184
Giperboloid_inzhenera_Garina_2;"К подъезду гостиницы бесшумно подкатил рольс-ройс – длинная машина с кузовом из красного дерева. Швейцар, бренча цепью, поспешил к крутящимся дверям.
";0.003002907187774196
Giperboloid_inzhenera_Garina_37;Аэроплан снизился над Ковной. Зеленое поле, смоченное дождем, быстро полетело навстречу. Аппарат прокатился и стал. Соскочил на траву пилот. Пассажиры;0.0013901898186805851
Giperboloid_inzhenera_Garina_48;"Обычно Вольф, уходя от профессора, прощался с Хлыновым на площади. На этот раз он пошел рядом с ним, постукивая тростью, опустив нахмуренное лицо.
– В";0.011669254549950365
Giperboloid_inzhenera_Garina_96;"Причальная мачта была готова. С Золотого острова сообщили, что дирижабль вылетел, несмотря на угрожающие показания барометра.
Все эти последние дни Ар";0.000811054515352258
Giperboloid_inzhenera_Garina_6;"До прибытия собаки-ищейки Шельга приступил к тщательному осмотру дачи, начиная с чердака.
Повсюду валялся мусор, битое стекло, обрывки обоев, ржавые б";0.000731098253141739
Giperboloid_inzhenera_Garina_44;"Несколько человек остановилось за дверью. Было слышно их дыхание. Гарин громко спросил по-французски:
– Кто там?
– Телеграмма, – ответил грубый голос,";0.0010170105850534376
Giperboloid_inzhenera_Garina_128;Едва только Гарин – один в закрытой машине – помчался через центральные улицы города, исчезло всякое сомнение: он вовремя унес ноги. Рабочие районы и ;0.0009297962938997663
Giperboloid_inzhenera_Garina_72;Двадцать восьмого с утра на городской площади в К. собирались кучками обыватели и, одни с недоумением, другие с некоторым страхом, обсуждали странные ;0.0005124685570359711
Giperboloid_inzhenera_Garina_102;– Господа, наступил наиболее тревожный момент в нашей работе. Я ждал его и приготовился, но это, разумеется, не уменьшает опасности. Мы блокированы. Т;0.0013333950093375184
Giperboloid_inzhenera_Garina_32;Обед окончен. Кофе со столетним коньяком выпито. Двухдолларовая сигара – «Корона Коронас» – выкурена до половины, и пепел ее не отвалился. Наступил му;0.0009250746523250472
Giperboloid_inzhenera_Garina_76;У портье гостиницы Зоя спросила, нет ли корреспонденции на имя мадам Ламоль? Ей подали радиотелефонограмму без подписи: «Ждите до вечера субботы». Зоя;0.00304193430102543
Giperboloid_inzhenera_Garina_126;"Дверь из капитанской каюты была открыта настежь. На койке лежал Янсен.
Яхта едва двигалась. В тишине было слышно, как разбивалась о борт волна.
Желани";0.0032296687019640734
Giperboloid_inzhenera_Garina_104;– Ну, что? – вызывающе спросил Гарин, кладя на письменный стол наушники радиоприемника. (Заседание происходило в том же составе, кроме мадам Ламоль.) ;0.003678295955954167
Giperboloid_inzhenera_Garina_24;Дойдя до середины бульвара, человек в коверкотовом пальто свернул в боковую узкую уличку, ведущую исхоженными ступенями на вершину Монмартра, внимател;0.0012280943028312613
Giperboloid_inzhenera_Garina_26;Здесь не было ни блестящего потока автомобилей, ни праздных людей, свертывающих себе шею, глядя на окна магазинов, ни головокружительных женщин, ни ин;0.0018029902619286552
Giperboloid_inzhenera_Garina_4;Когда из розовой зари над зарослями островов поднялось солнце, Тарашкин хрустнул мускулами и пошел во двор клуба собирать щепки. Время было шестой час;0.0073241737659443615
Giperboloid_inzhenera_Garina_5;Дача в чахлом березовом леску казалась необитаемой, – крыльцо сгнило, окна заколочены досками поверх ставен. В мезонине выбиты стекла, углы дома под о;0.0029283519068167307
Giperboloid_inzhenera_Garina_127;Секретарь – самый элегантный человек в Соединенных Штатах – лежал ничком, вцепившись застывшими пальцами в ковер: он умер мгновенно, без крика. Гарин,;0.003851792899333737
Giperboloid_inzhenera_Garina_117;Золото, как нефть, само шло из земли. Работы по углублению шахты приостановились. «Железный крот» был разобран и вынут. Временные фермовые крепления ш;0.012803218120179616
Giperboloid_inzhenera_Garina_38;В половине восьмого поутру, как обычно, Роллинг проснулся на улице Сены в кровати императора Наполеона. Не открывая глаз, достал из-под подушки носово;0.0005647736841635318
Giperboloid_inzhenera_Garina_25;Гарин и Виктор Ленуар подошли к небольшому кирпичному горну под колпаком. Рядом на столе лежали рядками пирамидки. На горне стояло на ребре толстое бр;0.0013739499848460161
Giperboloid_inzhenera_Garina_83;"Произошло самое страшное – Роллинг попал в смешное положение.
Что можно было сделать? Скрежетать зубами, бушевать, стрелять? – Еще хуже, еще глупее… К";0.001481981663154136
Giperboloid_inzhenera_Garina_100;"Дворец в северо-восточной части Золотого острова был построен по фантастическим планам мадам Ламоль.
Это было огромное сооружение из стекла, стали, те";0.00021135544564955465
Giperboloid_inzhenera_Garina_61;Глаза Шельги были завязаны платком. На плечах накинуто автомобильное кожаное пальто. Он почувствовал тепло, идущее от очага, – ноги его задрожали. Гар;0.010261800056664461
Giperboloid_inzhenera_Garina_115;"– Ну, как, Иван, здоровьишко?
Шельга погладил мальчика по голове. Иван сидел у него в маленьком прибрежном домике, у окна, глядел на океан. Домик был ";0.004344231936806594
Giperboloid_inzhenera_Garina_113;Впечатление, произведенное в Америке и Европе гибелью тихоокеанской эскадры, было потрясающее, небывалое. Североамериканские Соединенные Штаты получил;0.0007063198714657088
Giperboloid_inzhenera_Garina_34;Старый трехэтажный дом, номер шестьдесят три по улице Гобеленов, одною стеной выходил на пустырь. С этой стороны окна были только на третьем этаже – м;0.00044257378557803316
Giperboloid_inzhenera_Garina_82;Никогда не случалось, чтобы Роллинг отрывал пуговицы на пиджаке. Сейчас он открутил все три пуговицы. Он стоял посреди пышной, устланной ширазскими ко;0.001681186638474852
Giperboloid_inzhenera_Garina_12;Как все крупного масштаба деловые люди, химический король Роллинг принимал по делам в особо для того снятом помещении, офисе, где его секретарь фильтр;0.0008200411738236813
Giperboloid_inzhenera_Garina_10;В то же приблизительно время тот, кто называл себя Пьянковым-Питкевичем, подъехал на извозчике с поднятым верхом к одному из пустырей на Петроградской;0.0018975013129921353
Giperboloid_inzhenera_Garina_7;"На главном почтамте в одно из окошек приема заграничных телеграмм просунулась жирная красноватая рука и повисла с дрожащим телеграфным бланком.
Телегр";0.0008826138081055438
Giperboloid_inzhenera_Garina_91;"Тарашкин наказал Ивану посылать вести с дороги. Тревога его немного улеглась, когда он получил из Челябинска открытку:
«Дорогой товарищ Тарашкин, слав";0.015880234260890858
Giperboloid_inzhenera_Garina_43;В комнате Гарина окно с балконной решеткой было закрыто и занавешено. У стены стояли два чемодана. (Он жил в «Черном Дрозде» уже больше недели.) Гарин;0.0006414886863322667
Giperboloid_inzhenera_Garina_101;Шесть тысяч рабочих и служащих Золотого острова были набраны со всех концов света. Первый помощник Гарина, инженер Чермак, носивший звание губернатора;0.001638801825671423
Giperboloid_inzhenera_Garina_65;Оставался западный сектор, наиболее тяжелый. По карте там находилась пешеходная дорога к скалистому плато, где лежали знаменитые развалины замка «Прик;0.0033636760343324743
Giperboloid_inzhenera_Garina_108;События последних дней – нападение на американскую эскадру дирижабля «П Г» и приказ по флоту о бомбардировке – взбудоражили все население Золотого ост;0.0006067738871977952
Giperboloid_inzhenera_Garina_92;Александр Иванович Волшин прибыл в СССР с паспортом на имя Артура Леви и бумагами от Французского географического общества. Все документы были в поряд;0.0006827293573305001
Giperboloid_inzhenera_Garina_123;Янсен бежал по пустынным неосвещенным комнатам дворца. С грохотом и шипеньем обрушивался прибой на веранду. Свистал ветер, потрясая оконные рамы. Янсе;0.000195997215703038
Giperboloid_inzhenera_Garina_90;У калитки гребного клуба стоял скуластый, хорошо одетый гражданин и тростью ковырял землю. Он поднял голову и так странно поглядел на подходивших Тара;0.014486167890998432
Giperboloid_inzhenera_Garina_13;"Секретарь (с чудовищной вежливостью) спросил, держа золотой карандашик двумя пальцами:
– Простите, ваша фамилия?
– Генерал Субботин, русский… эмигрант";0.0053747965119691115
Giperboloid_inzhenera_Garina_39;В парижской прессе все эти дни было тихо, как на лесном озере. Буржуа зевали, читая передовицы о литературе, фельетоны о театральных постановках, хрон;0.000931397006793915
Giperboloid_inzhenera_Garina_21;Тыклинский поминутно раскланивался, расправлял висячие усы, влажно поглядывал на Зою Монроз и ел со сдержанной жадностью. Роллинг угрюмо сидел спиной ;0.0007848309849560282
