name;short_text;prob2_0
хуторок_в_степи_39;"Однажды в начале апреля Гаврик вернулся из типографии гораздо позже, чем всегда. Петя сидел в сарайчике и повторял геометрию.
– На Ленских приисках со";0.890563109501521
хуторок_в_степи_13;Вышли за волнорез и увидели его обратную сторону, обращенную в открытое море, где в брызгах и пене разбивающихся волн сновало множество рыболовов с дл;0.39524369628362227
хуторок_в_степи_21;Днем впереди появилось несколько высоких скалистых островков. В серебряном сиянии полуденного солнца, ослепляющем глаза, они казались воздушными силуэ;0.48079132231552696
хуторок_в_степи_4;Наступил сочельник, двадцать четвертое декабря – число, имевшее для семьи Бачей особое значение. Это был день ангела покойной мамы. Каждый год в этот ;0.13581577206028583
хуторок_в_степи_49;В этот день Василий Петрович проснулся очень поздно. Он спал всю ночь как убитый – тяжелым сном измученного, смертельно усталого человека, без сновиде;0.22160117848293578
хуторок_в_степи_34;Пятнадцатого августа начался учебный год, а за несколько дней до этого Василий Петрович отправился в училище Файга на переэкзаменовки. Он вернулся дом;0.09592603711715285
хуторок_в_степи_32;Теперь, когда у Пети появилась цель, город уже не казался таким пустынным и скучным. Было воскресенье. Звонили колокола. Весело посвистывал маленький ;0.9221389276518439
хуторок_в_степи_28;Петя все никак не мог забыть эту девочку. Как ни странно, он думал о ней часто, с горьким чувством разлуки и мысленно упрекал ее за то, что она внезап;0.0813307595243018
хуторок_в_степи_1;"Ветер с моря нес дождь, рвал из рук прохожих зонтики. В улицах было по-утреннему темно. Так же темно и тягостно было на душе у Пети.
Не доходя до знак";0.46008773391733304
хуторок_в_степи_16;Пароход шел на юг вдоль Салоникского залива. Слева было открытое море, справа тянулись пустынные берега, на первом плане низкие, а дальше холмистые, п;0.28013396271071633
хуторок_в_степи_23;"– Ну, а теперь давай, – сказал Павлик, кряхтя и потирая колено.
– Что?
– Давай! – повторил Павлик и даже протянул руку. – Давай половину лиры.
– Не по";0.7280053303136442
хуторок_в_степи_3;Павлик, которого только что «распустили» на каникулы, расхаживал перед домом в своей слишком длинной зимней шинели, сшитой «на рост», и в новых калоша;0.12777346488916141
хуторок_в_степи_5;"Накануне первого учебного дня, поздно вечером, сквозь сон Петя снова услышал за дверью столовой голоса папы и тети.
– Вы этого не сделаете, не должны ";0.09794130966035247
хуторок_в_степи_8;Никогда еще Петя не готовился к своим собственным урокам в гимназии так тщательно, как к этому уроку с Гавриком, где ему впервые предстояло выступить ;0.3426341627888029
хуторок_в_степи_33;Это был покупной, магазинный змей, имеющий форму геометрической фигуры – параллелепипеда, обтянутого по краям канареечно-желтым коленкором, с тугими р;0.4321132336841416
хуторок_в_степи_2;– Нет, как хотите, а это ужасно! – сказала за обедом тетя. Она положила разливательную ложку и схватилась пальцами за виски. – Можно относиться к Толс;0.07432054033146093
хуторок_в_степи_14;Самым сильным впечатлением в первые дни путешествия – да, впрочем, и потом – был вид открытого моря. День и две ночи – между Одессой и Босфором не был;0.11494478475857087
хуторок_в_степи_30;За время путешествия по Швейцарии Петя и Павлик сделались опытными железнодорожными пассажирами. Они научились безошибочно определять скорость поезда ;0.09626916475524237
хуторок_в_степи_15;Приближался вечер, а вместе с ним в неподвижном, отяжелевшем от зноя воздухе чувствовалось томительное созревание грозы. Она ниоткуда не шла, она как ;0.10897149621271676
хуторок_в_степи_45;Неизвестно, как бы пережил Петя следующий день в лихорадочном ожидании свидания, если бы не началась поливка сада. Петя с азартом крутил ручку цистерн;0.3709779988572694
хуторок_в_степи_43;Все были так подавлены, что целый день никто не мог работать. Смерть Чиновника казалась не только дурным предзнаменованием, но как бы окончательным кр;0.556668715130961
хуторок_в_степи_26;И вот они сидели в плетеных креслах на открытой террасе маленького недорогого пансиона в Уши, на берегу Женевского озера, которое по-французски называ;0.18858155875490645
хуторок_в_степи_27;Это небольшое происшествие произвело на Петю сильное впечатление. Он снова, незаметно для себя, стал размышлять о том не совсем понятном ему явлении, ;0.10858848032409471
хуторок_в_степи_9;"Все бросились к окнам, даже Петя, отшвырнувший подушку. Действительно, у ворот стояла карета Файга.
Господин Файг был одним из самых известных граждан";0.06128752318948114
хуторок_в_степи_52;С начала августа, в субботу, Петя и Гаврик, несколько раз обойдя степью вокруг хуторка и не заметив ничего подозрительного, вышли к обрывам, легли в п;0.9673488750270959
хуторок_в_степи_50;В течение пяти дней в неделю жизнь на хуторке ничем не отличалась от старой. По-прежнему семейство Бачей «в поте лица своего» трудилось в саду, окапыв;0.4586434740882732
хуторок_в_степи_37;В конце марта тете наконец удалось довольно выгодно передать квартиру. Теперь нужно было спешно вывозить куда-нибудь обстановку и переезжать. Посовето;0.6850033158590279
хуторок_в_степи_42;Чиновник, которого из экономии кормили не овсом, а травой, заболел сильнейшим поносом и уже четвертый день лежал с раздутым животом на своей подстилке;0.13996377321042114
хуторок_в_степи_54;Значит, они уезжают. Но Петя не успокоился до тех пор, пока собственными глазами не увидел, как они все влезли в вагон трамвая и уехали. Петя отправил;0.5436130923427057
хуторок_в_степи_29;В Интерлакене по настоянию Пети были куплены шерстяные плащи и альпенштоки – длинные палки с железными наконечниками для подъема в горы. Петя стал пог;0.029991741008443592
хуторок_в_степи_11;Неожиданные затруднения начались при получении заграничного паспорта из канцелярии градоначальника. Нужно было представить справку о политической благ;0.4074532348268435
хуторок_в_степи_48;После этого происшествия в усадьбе наступили тишина и спокойствие. Семейство Бачей вело себя так, как будто оно только что проснулось и еще не вполне ;0.5272250440984354
хуторок_в_степи_51;Скоро поспела вишня. Ее было не так много, как черешни, но возни с ней было не меньше. В самый разгар уборки неожиданно появилась мадам Стороженко. На;0.8015004441743532
хуторок_в_степи_20;Душная ночь была так черна, что даже огромное звездное небо не могло хоть сколько-нибудь рассеять тьму, среди которой как бы висел пароход. Только све;0.4237280315512184
хуторок_в_степи_53;Петя и Гаврик обошли хуторок и свернули на дорогу к станции. Недавно вместо конки пустили электрический трамвай, и теперь издали слышалось его виолонч;0.40379106084657684
хуторок_в_степи_6;Это был действительно прекрасный день, один из тех мартовских дней, когда снега уже нет, земля черна, над голыми прутьями приморских садов сквозь тучи;0.15291727030567356
хуторок_в_степи_44;С некоторых пор мальчик все время находился в состоянии какого-то скрытого возбуждения. С его лица не сходила напряженная, скользящая полуулыбка. Он н;0.39651566323892756
хуторок_в_степи_22;Вышли на какую-то улицу, забитую длинным рядом пустых, неподвижных вагонов электрического трамвая. Бастующие кондукторы и вожатые сурово прохаживались;0.5986286266719263
хуторок_в_степи_12;Вдруг Петя увидел Гаврика, который шел к нему, размахивая цветущей веткой белой акации. Петя не поверил своим глазам. Неужели Гаврик пришел его провод;0.9823370429883803
хуторок_в_степи_18;Долго огибали и наконец обогнули Грецию – мыс Малею, самую южную точку Европы. Последний остров, похожий на краюху сухого хлеба, потонул в лиловой зыб;0.2142800992993687
хуторок_в_степи_17;Однако надо было торопиться. Пароход отходил в пять часов, а Василий Петрович еще рассчитывал показать мальчикам афинские музеи. И он их показал. Но, ;0.31269947861009295
хуторок_в_степи_19;"Но зато как все чудесно изменилось, когда на следующий день вошли в Мессинский пролив и бросили якорь на рейде против города Мессины!
Здесь уже была ж";0.12063580031992178
хуторок_в_степи_46;В течение ближайших дней Марина не появлялась, Петя бросил в окно несколько секреток, в которых на разные лады выманивал девочку на свидание, даже обе;0.34076879432876084
хуторок_в_степи_38;Несколько раз Петя пытался поведать Гаврику о своей заграничной любви, но каждый раз, когда он, наскоро описав Везувий и голубой грот на Капри, где та;0.6397620338951269
хуторок_в_степи_10;Весна выдалась ранняя, жаркая, нарядная. Пасха прошла весело. Потом наступило время экзаменов, как всегда связанное в представлении Пети с короткими м;0.9322829074204536
хуторок_в_степи_47;Но как раз в это время начала поспевать черешня. Она стала поспевать быстро, бурно, а главное, все сорта сразу: черная, красная, розовая и белая. Хотя;0.6484177771606081
хуторок_в_степи_31;А на другой день они уже ехали с вокзала вместе с тетей на двух русских извозчиках домой мимо Куликова поля и Афонского подворья, которые показались П;0.6858857134389322
хуторок_в_степи_25;Поезд уже подходил к Риму. Бродячие музыканты – мандолина, гитара и скрипка, – остановившись среди вагона, ударили в последний раз по струнам. И под з;0.07287140162759224
хуторок_в_степи_7;Теперь Гаврик предстал перед Петей в синем засаленном сатиновом халате поверх старенького пальто с полысевшим каракулевым воротником и в такой же шапк;0.6917722589916955
хуторок_в_степи_41;Через несколько дней у Пети начались экзамены. Моте и ее маме стоило больших трудов привести в порядок – почистить, погладить и заштопать – Петин гимн;0.2160588178848942
хуторок_в_степи_35;Разумеется, грузить мешки Василий Петрович не пошел, и, хотя положение продолжало оставаться ужасным, даже трагическим, время текло своим чередом, и ж;0.07833383659941914
хуторок_в_степи_36;"На другой же день начались окончательные переговоры с мадам Васютинской, а также поиски денег на первый взнос и на первое обзаведение.
Петя впервые уз";0.5897233508325745
хуторок_в_степи_24;А на другой день с утра для них началась та ни с чем не сравнимая суетливая, утомительная и в то же время восхитительная жизнь, которая подхватила их,;0.19486183835469337
хуторок_в_степи_40;"– На вокзал со мной не хочешь сходить? – сказал однажды Гаврик, неожиданно появляясь за спиной Пети.
Петя в это время был поглощен зубрежкой и даже не";0.5600967849311003
