name;short_text;prob2_0
Doktor_57;В этой полосе чудесным образом сохранились деревни. Они составляли необъяснимо уцелевший островок среди моря разрушений. Гордон и Живаго возвращались ;0.06248973452355977
Doktor_162;Бабье лето прошло. Стояли ясные дни золотой осени. В западном углу Лисьего отока из земли выступала деревянная башенка сохранившегося добровольческого;0.010165755223246567
Doktor_167;От мысли перенести стан на зиму в другое место, подальше на восток отказались не сразу. Долго продолжались разведки и объезды местности по ту сторону ;0.010662285498274516
Doktor_168;В эти дни доктор видел Памфила Палых с семьею. Жена и дети его все истекшее лето провели в бегах по пыльным дорогам, под открытым небом. Они были напу;0.02693888995614028
Doktor_176;К группе читавших подошел исхудалый, давно не мывшийся и оттого казавшийся смуглым человек одичалого вида с котомкой за плечами и палкой. В сильно отр;0.001334100522041165
Doktor_79;"Главной новостью в Москве был для него этот мальчик. Едва Сашенька родился, как Юрия Андреевича призвали. Что он знал о сыне?
Однажды, будучи уже моби";0.0076154777465286825
Doktor_199;На обед, изготовленный впрок на три дня из свеженачатых запасов, Лариса Федоровна подала вещи небывалые: картофельный суп и жареную баранину с картошк;0.0022817271159432605
Doktor_19;Петровские линии производили впечатление петербургского уголка в Москве. Соответствие зданий по обеим сторонам проезда, лепные парадные в хорошем вкус;0.006368977813769767
Doktor_126;– Спасибо. Я сам, – отказывался Юрий Андреевич от предложенной помощи. Из теплушки нагибались, протягивали ему руки, чтобы подсадить. Он подтянулся, п;0.003738655663684723
Doktor_4;Летом тысяча девятьсот третьего года на тарантасе парой Юра с дядей ехали по полям в Дуплянку, имение шелкопрядильного фабриканта и большого покровите;0.009665766662673525
Doktor_81;Прошел август, кончался сентябрь. Нависало неотвратимое. Близилась зима, а в человеческом мире то, похожее на зимнее обмирание, предрешенное, которое ;0.0010091051874661376
Doktor_53;Лариса Федоровна обомлела и сначала не поверила своим ушам, когда узнала о Пашином решении. «Бессмыслица. Очередная причуда, – подумала она. – Не обра;0.00542669259974431
Doktor_93;"Настали последние дни марта, дни первого в году тепла, ложные предвестники весны, за которыми каждый год наступает сильное похолодание.
В доме Громеко";0.024600995490249723
Doktor_104;Кооператор Костоед сидел наверху в гостях у Живаго и со свистом обсасывал заячью лопатку, которой его угощали. Он боялся сквозняков и простуды. «Как т;0.0019800825163641387
Doktor_193;"Установилась зима. Валил снег крупными хлопьями. Юрий Андреевич пришел домой из больницы.
– Комаровский приехал, – упавшим хриплым голосом сказала выш";0.000819082046953369
Doktor_174;Давно настала зима. Стояли трескучие морозы. Разорванные звуки и формы без видимой связи появлялись в морозном тумане, стояли, двигались, исчезали. Не;0.0006852527170658506
Doktor_139;«Ясная морозная ночь. Необычайная яркость и цельность видимого. Земля, воздух, месяц, звезды скованы вместе, склепаны морозом. В парке поперек аллей л;0.015421121314406752
Doktor_74;Ночью в Сухиничах услужливый носильщик старого образца, пройдя с доктором по неосвещенным путям, посадил его с задней стороны в вагон второго класса к;0.007435489627062262
Doktor_109;Стало известно, что поезд отойдет через несколько часов, несмотря на позднее время и близость ночи. Перед его отправлением Юрий Андреевич и Антонина А;0.03486874160791995
Doktor_15;Тиверзин пришел домой на третий день, продрогший, невыспавшийся и небритый. Накануне ночью грянул мороз, небывалый для таких чисел, а Тиверзин был оде;0.007787760959961286
Doktor_116;"Кончалась северная белая ночь. Всё было видно, но стояло словно не веря себе, как сочиненное: гора, рощица и обрыв.
Рощица едва зазеленела. В ней цвел";0.005719351364295959
Doktor_231;– А мне правда есть что порассказать. Будто не из простых я, сказывали. Чужие ли мне это сказали, сама ли я это в сердце сберегла, только слышала я, б;0.0007286871758211243
Doktor_16;Патуля Антипов, сын арестованного Павла Ферапонтовича и помещенной в больницу Дарьи Филимоновны, поселился у Тиверзиных. Это был чистоплотный мальчик ;0.0019691478593865525
Doktor_6;Ники не оказалось ни в саду, ни в доме. Юра догадывался, что он прячется от них, потому что ему скучно с ними и Юра ему не пара. Дядя с Иваном Иванови;0.014370513593638192
Doktor_30;Как-то зимой Александр Александрович подарил Анне Ивановне старинный гардероб. Он купил его по случаю. Гардероб черного дерева был огромных размеров. ;0.006629020412275831
Doktor_107;"Расчистка пути заняла трое суток. Все Живаго, до Нюши включительно, приняли в ней деятельное участие. Это было лучшее время их поездки.
В местности бы";0.022460075828550155
Doktor_29;Несмотря на нормальное течение восстановившейся жизни, после декабря все еще постреливали где-нибудь, и новые пожары, какие бывают постоянно, казались;0.0008262992105967939
Doktor_149;Юрий Андреевич возвращался верхом из города в Варыкино. Он в несчетный раз проезжал эти места. Он привык к дороге, стал нечувствителен к ней, не замеч;0.0014957951201085334
Doktor_117;Скрипя всем корпусом, вагоны шли в гору по высокой насыпи. Под ней рос молодой мешаный лес, вершинами не достигавший ее уровня. Внизу были луга, с кот;0.021366207033338386
Doktor_76;На другой день доктор проснулся поздно. Был двенадцатый час. «Маркиз, Маркиз!» – вполголоса сдерживал сосед свою разворчавшуюся собаку. К удивлению Юр;0.0017977613359076506
Doktor_100;"В пути были уже три дня, но недалеко отъехали от Москвы. Дорожная картина была зимняя: рельсы путей, поля, леса, крыши деревень – все под снегом.
Семь";0.00834868009300286
Doktor_127;Предсказания Антонины Александровны сбылись. Перецепляя свои вагоны и добавляя новые, поезд без конца разъезжал взад и вперед по забитым путям, вдоль ;0.002195517324973161
Doktor_60;Эвакуационный госпиталь был затерян в одном из городков Западного края у железной дороги, по соседству со ставкою. Стояли теплые дни конца февраля. В ;0.012357371563679574
Doktor_86;На долгий период постоянной пищей большинства стало пшено на воде и уха из селедочных головок. Туловище селедки в жареном виде шло на второе. Питались;0.0007629420227099386
Doktor_150;Стояли города, села, станки. Город Крестовоздвиженск, станица Омельчино, Пажинск, Тысяцкое, починок Яглинское, Звонарская слобода, станок Вольное, Гур;0.06081228472949321
Doktor_191;Опять он ходил на вокзал и вернулся ни с чем, несолоно хлебавши. Все осталось нерешенным. Его и Лару ожидала неизвестность. День был холодный и темный;0.0003633013928277675
Doktor_21;"– Ах, Эмма Эрнестовна, это, милочка, неважно. Это надоело.
Он расшвыривал по ковру и дивану какие-то вещи, манжеты и манишки и вдвигал и выдвигал ящик";0.05467289744096374
Doktor_106;На другой день на тихом ходу с поминутными замедлениями, опасаясь схода со слегка завеянных метелью и неразметенных рельс, поезд остановился на покину;0.00260111229276398
Doktor_123;– Живаго, Живаго, – продолжал повторять Стрельников у себя в вагоне, куда они перешли. – Что-то купеческое. Или дворянское. Ну да: доктор из Москвы. В;0.005508582274033954
Doktor_222;Однажды утром в конце августа Юрий Андреевич с остановки на углу Газетного сел в вагон трамвая, шедший вверх по Никитской, от университета к Кудринско;0.002064163805417249
Doktor_9;"Война с Японией еще не кончилась. Неожиданно ее заслонили другие события. По России прокатывались волны революции, одна другой выше и невиданней.
В эт";0.009438024000396266
Doktor_101;Обыкновенно, когда поезд приближался к какой-нибудь станции, лежавшая наверху Антонина Александровна приподымалась в неудобной позе, к которой принужд;0.004294932997917432
Doktor_18;В комнату вошел толстый мужчина в серой рубашке, подпоясанный широким ремнем. Он был в валенках, штаны пузырились у него на коленках. Он производил вп;0.0006585019202784616
Doktor_160;По международной конвенции о Красном Кресте военные врачи и служащие санитарных частей не имеют права вооруженно участвовать в боевых действиях воюющи;0.00335885783479205
Doktor_128;Когда окрестности горящего города, цилиндрические баки, телеграфные столбы и торговые рекламы отступили вдаль и скрылись, и пошли другие виды, перелес;0.002077798329152747
Doktor_62;"В дожди черная пыль в городе превращалась в темно-коричневую слякоть, покрывавшую его улицы, в большинстве немощеные.
Городок был невелик. С любого ме";0.007396361693647224
Doktor_64;Госпиталь, в котором лежал, а потом служил и который собирался теперь покинуть доктор, помещался в особняке графини Жабринской, с начала войны пожертв;0.008261396101039048
Doktor_122;Кто же был, однако, этот человек? Удивительно, как на такие посты выдвинулся и мог на них удержаться беспартийный, которого никто не знал, потому что,;0.007202084696454819
Doktor_206;С Юрием Андреевичем творилось что-то несообразное. Он медленно сходил с ума. Никогда еще не вел он такого странного существования. Он запустил дом, пе;0.003640043226599856
Doktor_54;На фронт в штаб дивизии пришел поезд-баня, оборудованный на средства жертвователей Татьянинским комитетом помощи раненым. В классном вагоне длинного п;0.03130425627246715
Doktor_205;"«Что я наделал? Что я наделал? Отдал, отрекся, уступил. Броситься бегом вдогонку, догнать, вернуть. Лара! Лара!
Не слышат. Ветер в обратную сторону. И";0.0020594733199218065
Doktor_34;Уже весной тысяча девятьсот шестого года, перед переходом в последний класс гимназии, шесть месяцев ее связи с Комаровским превысили меру Лариного тер;0.01431873822109789
Doktor_41;Внутренние комнаты Свентицких были загромождены лишними вещами, вынесенными из гостиной и зала для большего простора. Тут была волшебная кухня хозяев,;0.04534684699023339
Doktor_172;Солдатка Кубариха заговаривала больную корову Палихи, Памфиловой жены Агафьи Фотиевны, в просторечии Фате?вны. Корову вывели из стада и поставили в ку;0.00154573863858192
Doktor_83;Было воскресенье. Доктор был свободен. Ему не надо было на службу. В Сивцевом уже разместились по-зимнему в трех комнатах, как предполагала Антонина А;0.00141908372193716
Doktor_147;"– Дайте руку и покорно следуйте за мной. Тут будет две комнаты, где темно и вещи навалены до потолка. Наткнетесь и ушибетесь.
– Правда, лабиринт какой";0.0016190405469481929
Doktor_161;Осенью лагерь партизан стоял в Лисьем отоке, небольшом лесу на высоком бугре, под которым неслась, обтекая его с трех сторон и подрывая берега водорои;0.0006278360941232372
Doktor_179;Воспоминание его не обмануло. Мастерская оставалась на старом месте, в ней работали. Мастерская занимала торговое помещение на уровне тротуара с витри;0.032405969760977205
Doktor_46;Отпевание кончилось. Нищие, зябко переступая с ноги на ногу, теснее сдвинулись в две шеренги. Колыхнулись и чуть-чуть переместились похоронные дроги, ;0.003087752692994961
Doktor_211;Остается досказать немногосложную повесть Юрия Андреевича, восемь или девять последних лет его жизни перед смертью, в течение которых он все больше сд;0.032489482598094546
Doktor_20;"Погода перемогалась. «Кап-кап-кап» – долбили капли по железу водосточных труб и карнизов. Крыша перестукивалась с крышею, как весною. Была оттепель.
В";0.08060523452940568
Doktor_140;«Как хотелось бы наряду со службой, сельским трудом или врачебной практикой вынашивать что-нибудь остающееся, капитальное, писать какую-нибудь научную;0.0020269033869952427
Doktor_32;Как-то вечером в конце ноября Юра вернулся из университета поздно, очень усталый и целый день не евши. Ему сказали, что днем была страшная тревога, у ;0.0024744982637917115
Doktor_220;Комната обращена была на юг. Она двумя окнами выходила на противоположные театру крыши, за которыми сзади, высоко над Охотным, стояло летнее солнце, п;0.07261839061045065
Doktor_65;Постепенно Юрий Андреевич стал готовиться к отъезду, обходил дома и учреждения, где надо было с кем-нибудь проститься, и выправлял необходимые бумаги.;0.0014832547731503949
Doktor_198;Когда встали, Юрий Андреевич стал с утра заглядываться на соблазнительный стол у окна. У него так я чесались руки засесть за бумагу. Но это право он о;0.002735577882889662
Doktor_229;"– Что это за река?
– Не знаю. Не спрашивал. Вероятно, Зуша.
– Нет, не Зуша. Какая-то другая.
– Ну, тогда не знаю.
– На Зуше-то ведь это все и случилос";0.000993416698978727
Doktor_87;"Дом, куда был приглашен доктор, оказался в конце Брестской, близ Тверской заставы.
Это было кирпичное казарменное здание допотопной стройки, с двором ";0.0073351977179133806
Doktor_38;Красный от натуги Паша, подперев щеку языком, бился перед зеркалом, надевая воротник и стараясь проткнуть подгибающуюся запонку в закрахмаленные петли;0.002992531605651762
Doktor_194;Было уже поздно. Освобождаемый временами от нагара фитилек светильни с треском разгорался, ярко освещая комнату. Потом все снова погружалось во мрак. ;0.002962710047816157
Doktor_24;"Она говорила себе: а если бы она была замужем? Чем бы это отличалось? Она вступила на путь софизмов. Но иногда тоска без исхода охватывала ее.
Как ему";0.033203715289043256
Doktor_207;Вот что случилось немного позднее в один из тех дней. Доктор внял наконец голосу разума. Он сказал себе, что, если поставить себе целью уморить себя в;0.04182861847358745
Doktor_35;Больше трех лет Лара прожила у Кологривовых как за каменной стеной. Ниоткуда на нее не покушались, и даже мать и брат, к которым она чувствовала больш;0.009921302904416708
Doktor_192;Юрий Андреевич пришел с вокзала усталый. Это был его ежедекадный выходной день. Обыкновенно он по этим числам отсыпался за всю неделю. Он сидел, откин;0.005113718001081742
Doktor_48;Руфина Онисимовна была передовой женщиной, врагом предрассудков, доброжелательницей всего, как она думала и выражалась, «положительного и жизнеспособн;0.000687884504395891
Doktor_121;"Перед поездом с этой стороны тянулся остаток путей и виднелась станция Развилье на горе в одноименном предместье.
С путей к станции вела некрашеная де";0.0033167512190359462
Doktor_186;"– Что ты так долго делала в Варыкине? Ведь там никого нет, пусто? Что тебя там задержало?
– Я убирала с Катенькой ваш дом. Я боялась, что ты первым де";0.0018804718392117
Doktor_40;С незапамятных времен елки у Свентицких устраивали по такому образцу. В десять, когда разъезжалась детвора, зажигали вторую для молодежи и взрослых и ;0.009472464395335932
Doktor_203;На снегу перед сараем в несколько кругов шли санные следы прежних заездов и заворотов Юрия Андреевича. Снег у порога был затоптан и замусорен позавчер;0.001604485654909438
Doktor_154;Не останавливаясь в передней, она прошла в шубе к себе в спальню. Окна комнаты выходили в сад. Теперь, ночью, нагромождения теней перед окном внутри и;0.0013646623077609797
Doktor_10;"Перед тем как переселиться в небольшую квартиру в три комнаты, находившуюся при мастерской, они около месяца прожили в «Черногории».
Это были самые уж";0.011696081537459813
Doktor_224;Когда покойника привезли по месту последнего жительства в Камергерский и извещенные и потрясенные известием о его смерти друзья вбежали с парадного в ;0.0018277266247457144
Doktor_113;Юрий Андреевич проснулся в начале ночи от смутно переполнявшего его чувства счастья, которое было так сильно, что разбудило его. Поезд стоял на какой-;0.015338248015498913
Doktor_200;К концу дня все помылись горячею водой, в изобилии оставшейся от стирки. Лара выкупала Катеньку. Юрий Андреевич с блаженным чувством чистоты сидел за ;0.0047389185007090705
