name;short_text;prob2_0
Doktor_91;У него был бред две недели с перерывами. Ему грезилось, что на его письменный стол Тоня поставила две Садовые: слева Садовую-Каретную, а справа Садову;0.03514141085681393
Doktor_73;Когда хранимый в секрете поезд составили и стали из-за здания депо задом подавать к станции, все, что было народу на лужайке, толпой бросились наперер;0.009328587655589256
Doktor_175;"По кривой горке к Малой Спасской и Новосвалочному спускалась Большая Купеческая. На нее заглядывали дома и церкви более возвышенных частей города.
На ";0.008813911407254906
Doktor_153;Галузина уже не раз доходила до привоза, торговой площади Крестовоздвиженска. Отсюда в дом к ней было налево. Но каждый раз она передумывала, поворачи;0.002237799653049413
Doktor_212;"Последнюю часть пути, ближе к Москве, Юрий Андреевич проехал по железной дороге, а первую, гораздо большую, прошел пешком.
Зрелище деревень, через кот";0.025842442060904323
Doktor_158;Это был период почти непрерывного отхода партизан на восток. Временами это перемещение являлось частью общего наступательного плана при оттеснении Кол;0.011454361748230375
Doktor_75;Доктор чувствовал себя разбитым событиями прошедшей недели, предотъездными волнениями, дорожными сборами и утренней посадкой на поезд. Он думал, что у;0.008766296681468251
Doktor_213;Как раз в эти дни, на этой части пути доктор зашел в сгоревшую дотла, покинутую жителями деревню. В ней до пожара строились только в один ряд, через д;0.01562986247102682
Doktor_108;Развалины станции полюбили, как можно привязаться к кратковременному пристанищу в экскурсии по снеговым горам. Запомнилось ее расположение, внешний об;0.008613618154672592
Doktor_110;Вдруг все изменилось, места и погода. Равнина кончилась, дорога пошла между гор – холмами и возвышенностями. Прекратился северный ветер, дувший все по;0.11475450549458899
Doktor_232;Прошло пять или десять лет, и однажды тихим летним вечером сидели они опять, Гордон и Дудоров, где-то высоко у раскрытого окна над необозримою вечерне;0.005272846445670406
Doktor_196;Они выехали из города утром серого зимнего дня. День был будничный. Люди шли по улицам по своим делам. Часто попадались знакомые. На бугристых перекре;0.0025774152511093638
Doktor_89;Уже совсем стемнело. Кругом была ночь. Только белый кружок света из карманного фонарика Деминой шагах в пяти перед ними скакал с сугроба на сугроб и б;0.008316990479079604
Doktor_188;"После некоторого перерыва она продолжала гораздо спокойнее:
– Я скажу тебе. Если бы Стрельников стал снова Пашенькой Антиповым. Если бы он перестал бе";0.002605887547843483
Doktor_156;Было одно живописное место на тракте. Расположенные по крутому скату, разделенные быстрой речкой Пажинкой, почти соприкасались: спускавшаяся сверху де;0.0009878664133590302
Doktor_58;"И вот опять они лежали по обе стороны длинного узкого окна, была ночь, и они разговаривали.
Живаго рассказывал Гордону, как он видел на фронте государ";0.001221837025711372
Doktor_171;Дни сократились. В пять часов темнело. Ближе к сумеркам Юрий Андреевич перешел тракт в том месте, где на днях Ливерий пререкался со Свиридом. Доктор н;0.03271226415654632
Doktor_143;Юрий Андреевич просматривал в зале Юрятинской городской читальни заказанные книги. Многооконный читальный зал на сто человек был уставлен несколькими ;0.017164193024140323
Doktor_25;Лара не была религиозна. В обряды она не верила. Но иногда для того, чтобы вынести жизнь, требовалось, чтобы она шла в сопровождении некоторой внутрен;0.025932751007802072
Doktor_134;"Зимою, когда времени стало больше, Юрий Андреевич стал вести разного рода записи. Он записал у себя:
«Как часто летом хотелось сказать вместе с Тютчев";0.0034420431877048995
Doktor_111;"Пока отсыпался Юрий Андреевич, весна плавила и перетапливала всю ту уйму снега, которая выпала в Москве в день отъезда и продолжала падать всю дорогу;";0.011508557266038562
Doktor_97;Накануне отъезда поднялась снежная буря. Ветер взметал вверх к поднебесью серые тучи вертящихся снежинок, которые белым вихрем возвращались на землю, ;0.0052746750457855155
Doktor_144;Юрий Андреевич сидел в дальнем конце зала, обложившись книгами. Перед ним лежали журналы по местной земской статистике и несколько работ по этнографии;0.02922686228030941
Doktor_141;«Первые предвестия весны, оттепель. Воздух пахнет блинами и водкой, как на масленой, когда сам календарь как бы каламбурит. Сонно, масляными глазками ;0.07296298701362817
Doktor_216;Был серый зимний воскресный день. Дым печей подымался не столбами вверх над крышами, а черными струйками курился из оконных форточек, куда, несмотря н;0.010357529922886494
Doktor_226;И вот она стала прощаться с ним простыми, обиходными словами бодрого бесцеремонного разговора, разламывающего рамки реальности и не имеющего смысла, к;0.010472225623260755
Doktor_82;Действительно, всевозможные случайности преследовали доктора в названном месте. Поздней осенью, незадолго до октябрьских боев, темным холодным вечером;0.04375910193558968
Doktor_214;"– Это ведь летошней осени озимые сыплются. Только высеялись, и повалили напасти. Когда тетя Поля уехала. Тетю Палашу помните?
– Нет. Да и не знал нико";0.0018887429783059862
Doktor_5;"– Жизненным нервом проблемы пауперизма, – читал Николай Николаевич по исправленной рукописи.
– Я думаю, лучше сказать – существом, – говорил Иван Иван";0.00039399578680009465
Doktor_136;"Ближе к весне доктор записал:
«Мне кажется, Тоня в положении. Я ей об этом сказал. Она не разделяет моего предположения, а я в этом уверен. Меня до по";0.005803842674850676
Doktor_105;Когда от среднерусской полосы удалились на восток, посыпались неожиданности. Стали пересекать неспокойные местности, области хозяйничанья вооруженных ;0.004090884587995175
Doktor_135;"Несколько позднее доктор записал:
«Мы поселились в задней части старого барского дома, в двух комнатах деревянной пристройки, в детские годы Анны Иван";0.0021170597550292255
Doktor_115;"Утром Антонина Александровна говорила:
– Удивительный ты все-таки, Юра. Весь соткан из противоречий. Бывает, муха пролетит, ты проснешься и до утра гл";0.004459292666642094
Doktor_151;На одном из перегонов дорога долго подымалась в гору. Обзор открывавшихся далей все расширялся. Казалось, конца не будет подъему и росту кругозора. И ;0.012745465704982244
Doktor_183;Не сам он, а что-то более общее, чем он сам, рыдало и плакало в нем нежными и светлыми, светящимися в темноте, как фосфор, словами. И вместе со своей ;0.08714190481565837
Doktor_201;Опять день прошел в помешательстве тихом. В доме отыскались детские салазки. Раскрасневшаяся Катенька в шубке, громко смеясь, скатывалась на неразмете;0.003457937379593981
Doktor_195;– Что с тобою, ангел мой? Которую уже ночь ты не спишь, не дотрагиваешься за столом до пищи, весь день ходишь как шальная. И все думаешь, думаешь. Что;0.0016915160454334126
Doktor_13;Осенью происходили волнения на железных дорогах московского узла. Забастовала Московско-Казанская железная дорога. К ней должна была примкнуть Московс;0.004400142762194991
Doktor_71;"Мадемуазель звонила Коле по телефону, чтобы он устроил доктора в поезде поудобнее, угрожая в противном случае неприятными для Коли разоблачениями.
Отв";0.008370441373781793
Doktor_69;"Еще через некоторое время стал собираться в дорогу Живаго. Ночью перед его отъездом в Мелюзееве была страшная буря.
Шум урагана сливался с шумом ливня";0.006305394477089174
Doktor_180;"Дверь отворила пожилая темноликая портниха в темном платье, строгая, может быть, старшая в заведении.
– Вот какой, привязался! Наказание в самом деле.";0.0013069340637731797
Doktor_51;Третий день стояла мерзкая погода. Это была вторая осень войны. Вслед за успехами первого года начались неудачи. Восьмая армия Брусилова, сосредоточен;0.002469199436317287
Doktor_28;Дом братьев Громеко стоял на углу Сивцева Вражка и другого переулка. Александр и Николай Александровичи Громеко были профессора химии, первый – в Петр;0.0005963202920655355
Doktor_137;"«Без конца перечитываем „Евгения Онегина“ и поэмы. Вчера был Анфим, навез подарков. Лакомимся, освещаемся. Бесконечные разговоры об искусстве.
Давнишн";0.02218249752071337
Doktor_157;Юрий Андреевич второй год пропадал в плену у партизан. Границы этой неволи были очень неотчетливы. Место пленения Юрия Андреевича не было обнесено огр;0.2674216326177273
Doktor_145;Первое намерение Юрия Андреевича было встать и подойти к Ларисе Федоровне. Но затем чуждые его природе, но установившиеся у него по отношению к ней пр;0.0029477935681882306
Doktor_131;Их вез на белой ожеребившейся кобыле лопоухий, лохматый, белый как лунь старик. Все на нем было белое по разным причинам. Новые его лапти не успели по;0.003636424515912703
Doktor_96;Тем временем как мужчины пропадали по учреждениям, выхлопатывая командировки и закрепительные бумаги на оставляемые комнаты, Антонина Александровна за;0.01940098560148186
Doktor_78;– Отстал наконец, отвязался. Ты верь ему, верь. Чистейший балаган один. При других всё дурачком, дурачком, а сам втайне на всякий случай ножик точит. ;0.0009989348302628536
Doktor_165;Стало известно, что беженки с детьми уже в двух переходах. В Лисьем отоке готовились к скорому свиданию с домашними и назначенному вслед за этим сняти;0.0022037410568683568
Doktor_77;"В дороге, благодаря неподвижному сидению в тесном купе, казалось, что идет только поезд, а время стоит и что все еще пока полдень.
Но уже вечерело, ко";0.0023951310850533723
Doktor_129;– Двадцать пять лет тому назад Микулицын студентом Технологического института приехал из Петербурга. Он был выслан сюда под надзор полиции. Микулицын ;0.0009493328193308017
Doktor_50;Через десять дней друзья устроили им проводы в той же комнате. Паша и Лара оба кончили, оба одинаково блестяще, оба получили предложения в один и тот ;0.0029058509426567367
Doktor_88;Прошедшие опрос и обыск жильцы один за другим возвращались в теплых платках и шубах в неотапливаемое помещение бывшего яичного склада, теперь занятое ;0.0024289481575463403
Doktor_55;В эти дни фронт зашевелился. На нем происходили внезапные перемены. К югу от местности, в которую заехал Гордон, одно из наших соединений удачной атак;0.001842273306585999
Doktor_43;Был первый или второй час ночи. У Юры стоял шум в ушах. После перерыва, в течение которого в столовой пили чай с птифурами, танцы возобновились. Когда;0.006611245575019743
Doktor_124;Поезд, довезший семью Живаго до этого места, еще стоял на задних путях станции, заслоненный другими составами, но чувствовалось, что связь с Москвою, ;0.31445550402085504
Doktor_103;"История Васи была иная. Его отца убили на войне. Мать послала Васю из деревни в учение к дяде в Питер.
Зимой дядю, владельца скобяной лавки в Апраксин";0.005814488017554524
Doktor_1;"Шли и шли и пели «Вечную память», и, когда останавливались, казалось, что ее по-залаженному продолжают петь ноги, лошади, дуновения ветра.
Прохожие пр";0.006819760852672961
Doktor_92;Он стал выздоравливать. Сначала, как блаженный, он не искал между вещами связи, все допускал, ничего не помнил, ничему не удивлялся. Жена кормила его ;0.06740057278661878
Doktor_218;Два дня Гордон и Дудоров не отходили от Марины. Они, сменяясь, дежурили при ней, боясь оставить ее одну. В промежутке они отправлялись на розыски докт;0.09237056460633392
Doktor_14;Через часа три или четыре, поближе к сумеркам, в стороне от дороги в поле как из-под земли выросли две фигуры, которых раньше не было на поверхности, ;0.002039278075358764
Doktor_90;Но тифом он заболел гораздо позднее. В промежутке бедствия семьи Живаго достигли крайности. Они нуждались и погибали. Юрий Андреевич разыскал спасенно;0.028304073936693756
Doktor_72;"Парило, когда уезжал Юрий Андреевич. Опять собиралась гроза, как третьего дня.
Глиняные мазанки и гуси в заплеванной подсолнухами привокзальной слобод";0.024260255366668045
Doktor_119;"Спать не было возможности от духоты и спертого воздуха. Голова доктора плавала в поту на промокшей от пота подушке.
Он осторожно спустился с края пола";0.005513115170331587
Doktor_187;"– Расскажи мне побольше о муже. «Мы в книге рока на одной строке», как говорит Шекспир.
– Откуда это?
– Из «Ромео и Джульетты».
– Я много говорила теб";0.02979575214179661
Doktor_66;Оказалось, что она уже дома. О ее приезде доктору сообщила мадемуазель и прибавила, что Лариса Федоровна вернулась усталою, наспех поужинала и ушла к ;0.00517124074551274
Doktor_163;"Был ясный солнечный день. Стояла тихая сухая, как всю предшествующую неделю, погода.
Из глубины лагеря катился смутный, похожий на отдаленный рокот мо";0.012932515429348037
Doktor_12;«Ведь для него мама – как это называется... Ведь он – мамин, это самое... Это гадкие слова, не хочу повторять. Так зачем в таком случае он смотрит на ;0.010069371248589518
Doktor_208;Они разговаривали уже давно, несколько битых часов, как разговаривают одни только русские люди в России, как в особенности разговаривали те устрашенны;0.0010384145410225838
Doktor_225;Ее всю сотрясали сдерживаемые рыдания. Пока она могла, она им сопротивлялась, но вдруг это становилось выше ее сил, слезы прорывались у нее, и она обд;0.11836585881603894
Doktor_94;"Для того чтобы об этом справиться, Юрий Андреевич пошел на Ярославский вокзал.
Поток уезжающих сдерживали мостки с перилами, протянутые через залы, на";0.0265586424902534
Doktor_190;"Так прошло месяца два или три. Как-то в октябре Юрий Андреевич сказал Ларисе Федоровне:
– Знаешь, кажется, мне придется уйти со службы. Старая, вечно ";0.0005276432223896196
Doktor_8;«Опять это лампадное масло!» – злобно подумал Ника и заметался по комнате. Голоса гостей приближались. Отступление было отрезано. В спальне стояли две;0.004504524482880371
Doktor_169;"На пороге зимы несколько причин охватили лагерь долгой полосой беспокойств, неизвестности, грозных и запутанных положений, странных несообразностей.
Б";0.13350265223401173
Doktor_49;Много горя было с Пашею. Пока Лара серьезно хворала, его не допускали к ней. Что должен был он почувствовать? Лара хотела убить человека, по Пашиным п;0.0022324341472605815
Doktor_47;"Лара лежала в полубреду в спальне на кровати Фелицаты Семеновны. Вокруг нее шептались Свентицкие, доктор Дроков, прислуга.
Пустой дом Свентицких был п";0.009395503189443653
Doktor_177;Эта печать состояла из газетных статей, протоколов речей на заседаниях и декретов. Юрий Андреевич бегло просматривал заглавия. «О порядке реквизиции и;0.00566098327108674
Doktor_185;– Ты должен непременно вернуться к своим. Я тебя лишнего дня не продержу. Но ты видишь, что делается. Едва мы слились с Советской Россией, как нас пог;0.005986582426705466
Doktor_166;Семьи партизан давно следовали на телегах за общим войском, с детьми и пожитками. За хвостом беженского обоза, совсем позади, гнали несметные гурты ск;0.004376696946253273
Doktor_31;"Весь ноябрь одиннадцатого года Анна Ивановна пролежала в постели. У нее было воспаление легких.
Юра, Миша Гордон и Тоня весной следующего года должны ";0.0031376963095776133
Doktor_204;"– Стрельников схвачен, приговорен к высшей мере, и приговор приведен в исполнение.
– Какой ужас. Неужели правда?
– Так я слышал. Я в этом уверен.
– Не";0.005338423437684286
Doktor_159;Работы у доктора среди партизан было по горло. Зимой – сыпной тиф, летом – дизентерия и, кроме того, усиливавшееся поступление раненых в боевые дни во;0.2707635678123478
Doktor_197;Дом Микулицыных был заперт на висячий замок, навешенный в уши дверного засова. Юрий Андреевич долго отбивал его и вырвал с мясом, вместе с оставшеюся ;0.04809829872287466
