name;short_text;prob2_0
b3_p13_h13;Пугающие тишиной, короткие дни под исход казались большими, как в страдную пору. Полегли хутора глухой целинной степью. Будто вымерло все Обдонье, буд;0.009402622111902511
b1_p3_h7;Обычно из верховских станиц Донецкого округа — Еланской, Вешенской, Мигулинской и Казанской — брали казаков в 11-й — 12-й армейские казачьи полки и в ;0.10399086841978504
b2_p9_h9;Через сутки полк был уже неподалеку от фронта. На узловой станции эшелоны остановили. Вахмистры разнесли приказ: «Выгружаться!» Торопливо сводили каза;0.021231409614300076
b2_p14_h14;За день до приезда Корнилова в Москву есаул Листницкий прибыл туда с поручением особой важности от Совета союза казачьих войск. Передав в штаб находив;0.08779483351547204
b1_p3_h19;Война и из Ягодного повыдергала людей. Ушли Вениамин и Тихон, после них стало еще глуше, тише, скучнее. Вместо Вениамина прислуживала старому генералу;0.01468008885455258
b1_p1_h23;Коршуновы приехали уже после того, как жениха с невестой увезли в церковь. Пантелей Прокофьевич до этого выходил за ворота, взглядывался вдоль улицы, ;0.033809948957319806
b1_p3_h3;Над степью — желтый солнечный зной. Желтой пылью дымятся нескошенные вызревшие заливы пшеницы. К частям косилки не притронуться рукой. Вверх не поднят;0.048484990910621736
b1_p2_h6;С давних пор велось так: если по дороге на Миллерово ехал казак один, без товарищей, то стоило ему при встрече с украинцами (слободы их начинались от ;0.08445745097319585
b2_p20_h20;Теплилась осень. Перепадали дожди. Над Быховом редко показывалось обескровленное солнце. В октябре начался отлет дикой птицы. Даже ночами звенел над п;0.06678146858059902
b1_p1_h12;"Оставалось полторы недели до прихода казаков из лагерей.
Аксинья неистовствовала в поздней горькой своей любви. Несмотря на угрозы отца, Григорий, тая";0.12257249579609283
b1_p2_h10;На пологом песчаном левобережье, над Доном, лежит станица Вешенская, старейшая из верховых донских станиц, перенесенная с места разоренной при Петре I;0.0354235514968812
b2_p22_h22;Полая вода только что начала сбывать. На лугу, около огородных плетней, оголилась бурая, илистая земля, каймой лежал наплав: оставшиеся от разлива обл;0.006993103075455995
b2_p30_h30;"Отряд татарских казаков под командой хорунжего Петра Мелехова прибыл в хутор Пономарев 11 мая на рассвете.
По хутору сновали казаки-чирцы, вели на вод";0.023886161812731923
b3_p25_h25;Кошевой, задумчиво похлопывая плеткой по голенищу, уронив голову, медленно всходил по порожкам моховского дома. Около дверей в коридоре, прямо на полу;0.015184595018579349
b1_p1_h2;Редкие в пепельном рассветном небе зыбились звезды. Из-под туч тянул ветер. Над Доном на дыбах ходил туман и, пластаясь по откосу меловой горы, сполза;0.007386244937385422
b3_p4_h4;15 мая атаман Всевеликого войска Донского Краснов, сопутствуемый председателем совета управляющих, управляющим отделом иностранных дел генерал-майором;0.5676610122152953
b4_p6_h6;Тотчас же, как только в Вешенской стало известно о спешном отступлении красных частей, Григорий Мелехов с двумя конными полками вплавь переправился че;0.010056401340008764
b3_p34_h34;На заре разведка, посланная к Красному яру, вернулась с известием, что красных не обнаружено до Еланской грани и что Петро Мелехов с десятью казаками ;0.014622796417108919
b3_p1_h1;"Как ты, батюшка, славный тихий Дон,
Ты кормилец наш, Дон Иванович,
Про тебя лежит слава добрая,
Слава добрая, речь хорошая,
Как, бывало, ты все быстер";0.47154195676412014
b2_p11_h11;Назначение генерала Корнилова главнокомандующим Юго-Западного фронта встречено было офицерским составом 14-го полка с большим сочувствием. О нем говор;0.11770543294951129
b1_p2_h21;"К просторному суходолу наростом прилипло имение Листницкого — Ягодное. Меняясь, дул ветер то с юга, то с севера; плыло в синеватой белизне неба солнце";0.0406779855618158
b4_p19_h19;"Небо заволокло тучами. Накрапывал мелкий, будто сквозь сито сеянный, дождь. Молодая отава, бурьяны, раскиданные по степи кусты дикого терна блестели.
";0.02114153663006528
b1_p2_h12;Аксинья отстряпалась рано, загребла жар, закутала трубу и, перемыв посуду, выглянула в оконце, глядевшее на баз. Степан стоял возле слег, сложенных ко;0.009248751464702932
b1_p3_h1;В марте 1914 года в ростепельный веселый день пришла Наталья к свекру. Пантелей Прокофьевич заплетал пушистым сизым хворостом разломанный бугаем плете;0.02575325303630094
b1_p3_h18;Выметываясь из русла, разбивается жизнь на множество рукавов. Трудно предопределить, по какому устремит она свой вероломный и лукавый ход. Там, где ны;0.025504909968247776
b1_p1_h7;"Аксинью выдали за Степана семнадцати лет. Взяли ее с хутора Дубровки, с той стороны Дона, с песков.
За год до выдачи осенью пахала она в степи, верст ";0.012718713647538519
b2_p21_h21;Полк отступал вторые сутки. Медленно, с боями, но отступал. По возвышенным грунтовым дорогам тянулись обозы русской и румынской армий. Объединенные ав;0.023288901657880477
b2_p28_h28;На западе густели тучи. Темнело. Где-то далеко-далеко, в полосе Обдонья, вилась молния, крылом недобитой птицы трепыхалась оранжевая зарница. В той ст;0.24117060663227688
b2_p10_h10;По возвращении из отпуска есаул Евгений Листницкий получил назначение в 14-й Донской казачий полк. В свой полк, в котором служил раньше и из которого ;0.048355839846322496
b3_p31_h31;В Вешенской к красному кирпичному зданию исполкома резво подкатила тачанка, конвоируемая двумя конными казаками. В задке полулежал Лихачев. Он встал, ;0.03076047259313354
b4_p21_h21;Мелеховская семья за один год убавилась наполовину. Прав был Пантелей Прокофьевич, сказав однажды, что смерть возлюбила их курень. Не успели похоронит;0.0036175804756267437
b1_p3_h13;Операция по захвату города началась рано утром. Пехотные части, имея на флангах и в резерве кавалерию, должны были повести наступление от леса с рассв;0.011149290313169758
b1_p3_h11;Небольшая в сафьяновом, цвета под дуб, переплете записная книжка. Углы потерты и заломлены: долго носил хозяин в кармане. Листки исписаны узловатым ко;0.013643665440927103
b1_p3_h2;Где-то позади, в сером слизистом тумане осталась длинная дорога от Маньково-Калитвенской слободы до местечка Радзивиллово. Пытался Григорий вспомнить ;0.055107025428932845
b2_p17_h17;Кинутые на Петроград части 3-го конного корпуса и Туземной дивизии эшелонировались на огромном протяжении восьми железных дорог: Ревель, Везенберг, На;0.019931442757881064
b1_p3_h22;На Юго-Западном фронте в районе Шевеля командование армии решило грандиозной кавалерийской атакой прорвать фронт противника и кинуть в тыл ему большой;0.004258414374113915
b1_p1_h18;Коршуновы слыли первыми богачами в хуторе Татарском. Четырнадцать пар быков, косяк лошадей, матки с Провальских заводов, полтора десятка коров, пропас;0.027443765041873902
b1_p1_h20;"Всходит остролистая зеленая пшеница, растет; через полтора месяца грач хоронится в ней с головой, и не видно; сосет из земли соки, выколосится; потом ";0.0153329996851539
b3_p16_h16;"Далеко за Доном — время перевалило уже за обед — пулемет глухо выщелкал две очереди и смолк.
Через полчаса Григорий, не отходивший от окна в горнице, ";0.0034852230874307397
b1_p2_h11;Наутро Григорий отправился к Мохову в дом. Сергей Платонович пришел из магазина к чаю. Сидел с Атепиным в столовой, оклеенной дорогими, под дуб, обоям;0.022051970458634027
b1_p2_h20;На шестом месяце, когда скрывать беременность было уже нельзя, Аксинья призналась Григорию. Она скрывала, боясь, что Григорий не поверит в то, что его;0.04838695111912471
b3_p21_h21;Снег падал и таял на лету. В полдень в ярах с глухим шумом рушились снежные оползни. За Доном шумел лес. Стволы дубов оттаяли, почернели. С ветвей сры;0.03396672622727565
b1_p1_h16;Только после того как узнал от Томилина про Аксинью, понял Степан, вынашивая в душе тоску и ненависть, что, несмотря на плохую жизнь с ней, на ту давн;0.013814814800236384
b4_p3_h3;"Поздно ночью Григорий пришел из штаба на квартиру. Прохор Зыков ожидал его у калитки.
— Про Аксинью не слышно? — спросил Григорий с деланным равнодуши";0.007043342434218235
b1_p2_h2;В конце августа Митька Коршунов случайно встретился возле Дона с дочерью Сергея Платоновича Елизаветой. Он только что приехал из-за Дона и, примыкая к;0.0024043628565979655
b2_p12_h12;В сотне Листницкого был казак Букановской станицы Лагутин Иван. По первым выборам он прошел в члены полкового Военно-революционного комитета, до прихо;0.010268135845869933
b1_p1_h5;До хутора Сетракова — места лагерного сбора — шестьдесят верст. Петро Мелехов и Астахов Степан ехали на одной бричке. С ними еще трое казаков-хуторян:;0.042898466494219877
b3_p29_h29;На рассвете, измученный, Кошевой въехал в хутор Большой Усть-Хоперской станицы. Его остановила застава 4-го Заамурского полка. Двое красноармейцев отв;0.049111716521411664
b1_p1_h1;Мелеховский двор — на самом краю хутора. Воротца со скотиньего база ведут на север к Дону. Крутой восьмисаженный спуск меж замшелых в прозелени меловы;0.01976210960371602
b1_p2_h14;Сотник Евгений Листницкий служил в лейб-гвардии Атаманском полку. На офицерских скачках разбился, переломил в предплечье левую руку. После лазарета вз;0.023838051419288537
b3_p24_h24;Из глубоких затишных омутов сваливается Дон на россыпь. Кучеряво вьется там течение. Дон идет вразвалку, мерным тихим разливом. Над песчаным твердым д;0.047608558189623486
b2_p13_h13;6 августа начальник штаба верховного главнокомандующего генерал Лукомский, через первого генерал-квартирмейстера Ставки генерала Романовского, получил;0.016159204459675818
b3_p23_h23;"Петро только что наметал скотине и вошел в курень, выбирая из варежек сенные остья. Сейчас же звякнула щеколда в сенцах.
Закутанная в черный ковровый ";0.06182152316873583
b2_p29_h29;В ночь эту, обрызганную молочным светом бледно-желтых звезд, в лавчушке, набитой людьми до отказа, почти не было сна. Короткие гасли разговоры. Духота;0.017928745756941384
b2_p7_h7;Маленькими смуглыми руками, покрытыми редким глянцем волоса, щупал Сергей Платонович Мохов жизнь со всех сторон. Иногда и она с ним заигрывала, иногда;0.007606340950311488
b3_p6_h6;Вызрел ковыль. Степь на многие версты оделась колышущимся серебром. Ветер упруго приминал его, наплывая, шершавил, бугрил, гнал то к югу, то к западу ;0.013591221001704868
b4_p16_h16;Несколько дней после разговора с Дарьей Наталья жила, испытывая такое ощущение, какое бывает во сне, когда тяжко давит дурной сон и нет сил очнуться. ;0.00383241716763776
b3_p7_h7;"По линии Филоново — Поворино выравнивался фронт. Красные стягивали силы, копили кулак для удара. Казаки вяло развивали наступление; испытывая острую н";0.0019504608836155488
b4_p10_h10;"На рассвете его разбудил Копылов.
— Вставай, пора собираться, ехать! Приказано ведь быть к шести часам.
Начальник штаба только что побрился, вычистил ";0.01601762828354767
b2_p15_h15;В версте от развалин местечка, стертого орудийным огнем июньских боев, возле леса причудливо вилюжились зигзаги окопов. Участок у самой опушки занимал;0.07012501126510888
b2_p23_h23;После ухода Кошевого казаки сидели некоторое время молча. Над хутором шатался набатный гуд, мелко дребезжали оконца хаты. Иван Алексеевич смотрел в ок;0.13256380228649087
b1_p3_h23;"К глазной лечебнице доктора Снегирева примыкал маленький садик.
Таких неуютных стриженых садов много по окраинным переулкам Москвы, в них не отдыхает ";0.005232950933692124
b4_p11_h11;Казачьи сотни четвертый раз вставали из неглубоких окопов и под убийственным пулеметным огнем красных залегали снова. Красноармейские батареи, укрытые;0.015675457189584
b1_p2_h9;"Вечером у косой Лукешки в половине Штокмана собирался разный люд; приходил Христоня, с мельницы Валет в накинутом на плечи замасленном пиджаке; скалоз";0.11384800571291089
b3_p35_h35;Приказом командующего объединенными повстанческими силами Верхнего Дона Григорий Мелехов назначен был командиром Вешенского полка. Десять сотен казако;0.08370968168114094
b2_p1_h1;Тысяча девятьсот шестнадцатый год. Октябрь. Ночь. Дождь и ветер. Полесье. Окопы над болотом, поросшим ольхой. Впереди проволочные заграждения. В окопа;0.004629585572096609
b3_p2_h2;С Дона через Украину катились красные составы вагонов, увозя в Германию пшеничную муку, яйца, масло, быков. На площадках стояли немцы в бескозырках, в;0.009684021930404279
b4_p22_h22;Четырнадцать изловленных дезертиров ждали суда. Суд был короткий и немилостивый. Престарелый есаул, председательствовавший на заседаниях, спрашивал у ;0.05582158080697452
b2_p27_h27;Несколько дней экспедиция шла в глубь Донецкого округа, прорываясь к Краснокутской станице. Население украинских слобод встречало отряд с неизменным р;0.019807777156553148
b4_p1_h1;Верхнедонское восстание, оттянувшее с Южного фронта значительное количество красных войск, позволило командованию Донской армии не только свободно про;0.004654579073089444
b3_p37_h37;Весна отворяла жилы рек. Ядренее становились дни, звучнее нагорные зеленые потоки. Солнце приметно порыжело, слиняла на нем немощно-желтая окраска. Ос;0.021662447487932845
b1_p2_h19;"Степан подошел к Григорию и, ухватившись за стремя, плотно прижался к потному боку жеребца.
— Ну, здорово, Григорий!
— Слава богу.
— Что ж ты думаешь?";0.01699583345572597
b1_p3_h10;Фронт еще не улегся многоверстной неподатливой гадюкой. На границе вспыхивали кавалерийские стычки и бои. В первые дни после объявления войны германск;0.03732527870950916
b4_p25_h25;Через месяц Григорий выздоровел. Впервые поднялся он с постели в двадцатых числах ноября и — высокий, худой, как скелет, — неуверенно прошелся по комн;0.003929480637268634
b1_p2_h17;"Григорий вернулся из Миллерова, куда отвозил Евгения, в вербное воскресенье. Оттепель съела снег; дорога испортилась в каких-нибудь два дня.
В Ольхово";0.013960991876211089
b4_p7_h7;Генерала Секретева, приехавшего в Вешенскую со штабными офицерами и сотней казаков личного конвоя, встречали хлебом-солью, колокольным звоном. В обеих;0.011164904458822766
b2_p24_h24;В Каргинскую приехали перед вечером. В станице уже не было фронтовиков — ушли на Мигулинскую. Петро, спешив свой отряд на площади, возле магазина купц;0.050950905075629015
b3_p9_h9;И после, когда полк вступил в полосу непрерывных боев, когда вместо завес уже лег изломистой вилюжиной фронт, Григорий всегда, сталкиваясь с неприятел;0.015945812959653367
b4_p12_h12;Дня через три после отъезда Григория явился в хутор Татарский Митька Коршунов. Приехал он не один, его сопровождали двое сослуживцев по карательному о;0.012016600171183792
b3_p18_h18;Фронт прошел. Отгремели боевые деньки. В последний день пулеметчики 13-го кавполка перед уходом поставили на широкоспинные тавричанские сани моховский;0.05007424024952189
b4_p13_h13;Удивительно, как изменилась жизнь в семье Мелеховых! Совсем недавно Пантелей Прокофьевич чувствовал себя в доме полновластным хозяином, все домашние е;0.003683838890825402
b1_p2_h7;Зима легла не сразу. После покрова стаял выпавший снег, и табуны снова выгнали на подножный. С неделю тянул южный ветер, теплело, отходила земля, ярко;0.09387187710187941
b1_p3_h6;Казаки-второочередники с хутора Татарского и окрестных хуторов на второй день после выступления из дому ночевали на хуторе Ея. Казаки с нижнего конца ;0.022393492979935904
b3_p30_h30;В Татарском в день приезда Григория уже сформировались две сотни казаков. На сходе постановили мобилизовать всех способных носить оружие, от шестнадца;0.02019348813290735
