name;short_text;prob2_0
b3_p19_h19;Казакует по родимой степи восточный ветер. Лога позанесло снегом. Падины и яры сровняло. Нет ни дорог, ни тропок. Кругом, наперекрест, прилизанная вет;0.014850204461469676
b4_p8_h8;Темны июньские ночи на Дону. На аспидно-черном небе в томительном безмолвии вспыхивают золотые зарницы, падают звезды, отражаясь в текучей быстрине До;0.004674216867748303
b1_p1_h22;"Отдохнувшие у Коршуновых лошади шли, добираясь до мелеховского база, из последних сил. На ременных шлеях, стекая, клубилась пена.
Подвыпившие кучера г";0.07133673960174708
b2_p31_h31;Мишка Кошевой и Валет только на вторую ночь вышли из Каргинской. Туман пенился в степи, клубился в балках, ник в падинах, лизал отроги Яров. Опушенные;0.06444097294927344
b4_p14_h14;На другой день вернулись с поля косари. Пантелей Прокофьевич решил с обеда начинать возку сена. Дуняшка погнала к Дону быков, а Ильинична и Наталья пр;0.017530061426347422
b1_p1_h6;"Возле лобастого, с желтой песчаной лысиной кургана остановились ночевать.
С запада шла туча. С черного ее крыла сочился дождь. Поили коней в пруду. На";0.08203116293460724
b2_p16_h16;"Уже 29 августа из телеграмм, получаемых от Крымова, Корнилову стало ясно, что дело вооруженного переворота погибло.
В два пополудни в Ставку прибыл от";0.07093855100397704
b1_p1_h21;"За невестой в поезжанье нарядили четыре пароконные подводы. По-праздничному нарядные люди толпились на мелеховском базу возле бричек.
Дружко — Петро —";0.04662705254506268
b2_p26_h26;Эти дни он жил, как в тифозном бреду. Ходил, делал что-то, ел, спал, но все это словно в полусне, одуряющем и дурманном. Ошалелыми припухлыми глазами ;0.031033840060875974
b3_p26_h26;Григория заставили из Боковской ехать в Чернышевскую. Вернулся он через полторы недели. А за два дня до его приезда арестовали отца. Пантелей Прокофье;0.019259826202364654
b3_p36_h36;Из Каргинской Григорий повел на Боковскую уже три с половиной тысячи сабель. Вдогон ему штаб и окрисполком слали нарочными приказы и распоряжения. Оди;0.038763852962732916
b1_p3_h9;Из этого после сделали подвиг. Крючков, любимец командира сотни, по его реляции получил Георгия. Товарищи его остались в тени. Героя отослали в штаб д;0.07121095854009696
b3_p39_h39;После бегства из Татарского Штокман, Кошевой, Иван Алексеевич и еще несколько казаков, служивших милиционерами, пристали к 4-му Заамурскому полку. Пол;0.0015268269800275624
b4_p23_h23;17 сентября части ударной группы Шорина, сделав тридцативерстный переход, вплотную подошли к Дону. С утра 18-го красные батареи загремели от устья Мед;0.3411593624875475
b1_p2_h5;Григорий с женой выехали пахать за три дня до покрова. Пантелей Прокофьевич прихворнул: опираясь на костыль, охая от боли, ломавшей поясницу, вышел пр;0.019877345742711158
b2_p5_h5;Сбочь хутора Татарского, по небу, изморщенному седой облачной рябью, колесило осеннее солнце. Там, вверху, тихий ветерок лишь слегка подталкивал тучи,;0.005586097054283775
b4_p15_h15;Стремительно преследуя отступавшего от Усть-Медведицкой противника, объединенные части Донской армии и верхнедонских повстанцев шли на север. Под хуто;0.01966715809756727
b1_p2_h15;На четвертой неделе поста сдала зима. На Дону бахромой легли окраинцы, ноздревато припух, поседел подтаявший сверху лед. Вечерами глухо гудела гора, п;0.03939579829345723
b2_p3_h3;На Владимиро-Волынском и Ковельском направлениях, в районе действий Особой армии (армия была по счету тринадцатой, но так как 13 — цифра несчастливая,;0.0011100975497696389
b3_p3_h3;Неделю отдыхал Мишка, целые дни проводя в седле. Степь его покоряла, властно принуждала жить первобытной, растительной жизнью. Косяк ходил где-нибудь ;0.0024772462890094845
b2_p25_h25;Номерным у Бунчука был казак с хутора Татарского Максимка Грязнов. Коня потерял он в бою с кутеповским отрядом, с той поры безудержно запил, пристраст;0.0018493354314434163
b3_p5_h5;Во время ледяного похода 60 Евгений Листницкий был ранен два раза: первый раз — в бою за овладение станицей Усть-Лабинской, второй — при штурме Екатер;0.0006345762862371798
b1_p1_h14;— …Тоскую по нем, родная бабунюшка. На своих глазыньках сохну. Не успеваю юбку ушивать — что ни день, то шире становится… Пройдет мимо база, а у меня ;0.021686515969762996
b1_p3_h24;В ночь на 4 ноября Григорий Мелехов пришел в Нижне-Яблоновский, первый от станции казачий хутор Вешенского юрта. До имения Ягодного оставалось несколь;0.031590978591857104
b3_p12_h12;Враждебность, незримой бороздой разделившая офицеров и казаков еще в дни империалистической войны, к осени 1918 года приняла размеры неслыханные. В ко;0.1489400513226635
b2_p4_h4;Верст на сорок ниже по Стоходу шли бои. Две недели неумолчно стонал сплошной орудийный гул, по ночам далекое фиолетовое небо кромсали отсветы прожекто;0.009141172833692037
b2_p6_h6;В ноябре в обним жали морозы. Ранний перепадал снежок. На колене против верхнего конца хутора Татарского стал Дон. По хрупкому сизому льду перебиралис;0.03656494397441398
b1_p3_h12;11-я кавалерийская дивизия после занятия Лешнюва с боем прошла через Станиславчик, Радзивиллов, Броды и 15 августа развернулась возле города Каменка-С;0.021050606306296824
b3_p17_h17;В полдень через хутор спешным маршем прошел 6-й Мценский краснознаменный полк, захватив кое у кого из казаков строевых лошадей. За бугром далеко погро;0.011831622400299769
b3_p10_h10;Цепь дней. Звено, вкованное в звено. Переходы, бои, отдых. Жара. Дождь. Смежные запахи конского пота и нагретой кожи седла. В жилах от постоянного нап;0.022670005226900426
b4_p26_h26;— Ну, война кончилась! Пихнули нас красные так, что теперича до самого моря будем пятиться, пока не упремся задом в соленую воду, — сказал Прохор, ког;0.009603869014602572
b3_p28_h28;В кизячнике густо пахнет сухим навозом, выпревшей соломой, объедьями сена. Сквозь чакановую крышу днем сочится серый свет. В хворостяные ворота, как с;0.024150388279184688
b4_p27_h27;Дни потянулись серые и безрадостные. Оставив Аксинью, Григорий сразу утратил интерес к окружающему. С утра садился в сани, ехал по раскинувшейся бескр;0.009283062472581061
b1_p3_h14;В первых числах августа сотник Евгений Листницкий решил перевестись из лейб-гвардии Атаманского полка в какой-либо казачий армейский полк. Он подал ра;0.038654862947506675
b2_p18_h18;"31 августа в Петрограде застрелился вызванный туда Керенским генерал Крымов.
С повинной потекли в Зимний дворец делегации и командиры частей крымовско";0.04918986886328107
b2_p19_h19;В последних числах октября, рано утром, есаул Листницкий получил распоряжение от командира полка — с сотней в пешем строю явиться на Дворцовую площадь;0.03221143998174628
b1_p3_h20;Ярко, до слепящей боли, вспомнилась Григорию та ночь. Он очнулся перед рассветом, повел руками, натыкаясь на колючее жнивье, и застонал от садной боли;0.010426652714318958
b1_p2_h3;"Наталья пришлась Мелеховым ко двору. Мирон Григорьевич детей школил; не глядя на свое богатство и на то, что помимо них были работники, заставлял рабо";0.044346802925079316
b1_p1_h10;"Не лазоревым алым цветом 10, а собачьей бесилой, дурнопьяном придорожным цветет поздняя бабья любовь.
С лугового покоса переродилась Аксинья. Будто кт";0.017172375565760227
b1_p3_h8;В местечке Торжок полк разбили по сотням. Шестая сотня, на основании приказа штаба дивизии, была послана в распоряжение Третьего армейского пехотного ;0.0071538958193735165
b1_p2_h13;Беда в одиночку сроду не ходит: утром, по недогляду Гетька, племенной бугай Мирона Григорьевича распорол рогом лучшей кобылице-матке шею. Гетько прибе;0.0240996283571671
b1_p2_h4;"В конце октября, в воскресенье, — поехал Федот Бодовсков в станицу.
В кошелке отвез на базар четыре пары кормленых уток, продал; в лавке купил жене си";0.0903330676874462
b3_p15_h15;"Решение не отступать вновь вернуло в глазах Пантелея Прокофьевича силу и значимость вещам.
Вечером вышел он метать скотине и, уже не колеблясь, надерг";0.016870022231955942
b4_p2_h2;"В эту ночь около хутора Малого Громчонка полк красноармейцев переправился через Дон на сбитых из досок и бревен плотах.
Громковская сотня была застигн";0.011706545001076705
b4_p18_h18;Григорий страдал не только потому, что он по-своему любил Наталью и свыкся с ней за шесть лет, прожитых вместе, но и потому, что чувствовал себя винов;0.0075279358571891325
b2_p2_h2;"На другой день утром смущенный вахмистр вошел в землянку Листницкого; помявшись, сообщил:
— Нынче утром казаки, ваше благородие, нашли в окопах вот эт";0.01337045920070973
b3_p27_h27;На второй день после приезда с Сингина Кошевой отправился в Вешенскую узнать, когда будет собрание комячейки. Он, Иван Алексеевич, Емельян, Давыдка и ;0.006025976158703006
b3_p11_h11;В конце ноября в Новочеркасске стало известно о прибытии военной миссии держав Согласия. По городу пошли упорные слухи о том, что мощная английская эс;0.44038273416088797
b3_p32_h32;Из-за Дона, с верховьев, со всех краев шли вести о широком разливе восстания. Поднялось уже не два станичных юрта. Шумилинская, Казанская, Мигулинская;0.0742975514909596
b1_p3_h21;Вагон мягко покачивает, перестук колес убаюкивающе сонлив, от фонаря до половины лавки желтая вязь света. Так хорошо вытянуться во весь рост и лежать ;0.011058207921454673
b1_p1_h4;К вечеру собралась гроза. Над хутором стала бурая туча. Дон, взлохмаченный ветром, кидал на берега гребнистые частые волны. За левадами палила небо су;0.06979542645617674
b1_p1_h13;С того дня, как приезжала баба Томилина, подурнел Степан с лица. Висли на глаза брови, ложбинка глубокая и черствая косо прорезала лоб. Он мало говори;0.017326863589887366
b4_p17_h17;Многое передумал и вспомнил Григорий за двое суток пути от фронта до родного хутора… Чтобы не оставаться в степи одному со своим горем, с неотступными;0.009312268090508407
b3_p14_h14;В Вешенской на заборах трепыхались фоминские приказы. С часу на час ждали прихода красных войск. А в Каргинской, в тридцати пяти верстах от Вешенской,;0.1432118416692282
b1_p1_h17;За житом — не успели еще свозить на гумна — подошла и пшеница. На суглинистых местах, на пригорках желтел и сворачивался в трубку подгорающий лист, пе;0.06418661852414718
b4_p20_h20;Донская армия, выйдя за границу Хоперского округа, вновь, как в 1918 году, утратила наступательную силу своего движения. Казаки-повстанцы Верхнего Дон;0.06909183158642386
b1_p1_h19;В коршуновском курене предсвадебная суета. Невесте наспех дошивали кое-что из белья. Наталья вечера просиживала, вывязывая жениху традиционный шарф из;0.017875294654604402
b1_p2_h16;"У Штокмана стали собираться реже. Подходила весна. Хуторцы готовились к весенней работе; лишь с мельницы приходили Валет с Давыдкой и машинист Иван Ал";0.07886832485402605
b4_p4_h4;Каждый день Ильинична просыпалась чуть свет, доила корову и начинала стряпаться. Печь в доме не топила, а разводила огонь в летней кухне, готовила обе;0.008054855273846707
b3_p22_h22;Вокруг хуторского ревкома сгруппировалось несколько человек: Давыдка-вальцовщик, Тимофей, бывший моховский кучер Емельян и рябой чеботарь Филька. На н;0.01334663381670795
b1_p2_h22;На шестом месяце, когда скрывать беременность было уже нельзя, Аксинья призналась Григорию. Она скрывала, боясь, что Григорий не поверит в то, что его;0.04838695111912471
b1_p2_h8;Пантелей Прокофьевич вернулся со схода и прямо прошел в боковушку, комнату, которую он занимал со старухой. Ильинична эти дни прихварывала. На водянис;0.022102918723710573
b3_p20_h20;В конце января Иван Алексеевич выехал в Вешенскую по вызову председателя окружного ревкома. К вечеру он должен был вернуться. Его ждали. Мишка сидел в;0.012483876859327475
b3_p8_h8;"Неподалеку от станицы Дурновской Вешенский полк в первый раз ввязался в бой с отступавшими частями красноармейцев.
Сотня под командой Григория Мелехов";0.010629350591366334
b1_p1_h15;"— Петру скажи, чтобы запрягал кобылу и своего коня.
Григорий вышел на баз. Петро выкатывал из-под навеса сарая бричку.
— Батя велит запрягать кобылу и";0.010834087258397771
b1_p2_h23;"К просторному суходолу наростом прилипло имение Листницкого — Ягодное. Меняясь, дул ветер то с юга, то с севера; плыло в синеватой белизне неба солнце";0.0406779855618158
b4_p5_h5;Под командованием генерала Секретева трехтысячная конная группа Донской армии при шести конных орудиях и восемнадцати вьючных пулеметах 10 июня сокруш;0.1699453589693543
b4_p24_h24;Две с половиной недели Пантелей Прокофьевич благополучно прожил с семьей в хуторе Латышевом и, как только услышал, что красные отступили от Дона, собр;0.0039030149006012717
b4_p29_h29;Соленый, густой, холодный ветер дул с моря. Запах неведомых чужих земель нес он к берегу. Но для донцов не только ветер — все было чужое, неродное в э;0.010161943341986205
b1_p2_h1;"Сергей Платонович Мохов издалека ведет свою родословную.
В годы царствования Петра I шла однажды в Азов по Дону государева баржа с сухарями и огнестре";0.017546668937277035
b3_p33_h33;Григорий с полусотней потрепал обоз первого разряда заамурцев. Восемь красноармейцев было зарублено. Взято четыре подводы с патронами и две верховые л;0.01591490381403003
b4_p9_h9;"Бой шел на подступах к станице Усть-Медведицкой. Глухой орудийный гул заслышал Григорий, выбравшись с летника на Гетманский шлях.
Всюду по шляху видне";0.01790692848399718
b4_p28_h28;"За всю дорогу до самой станицы Абинской Григорию запомнилось только одно; беспросветной темной ночью очнулся он от резкого, пронизывающего насквозь хо";0.012881749136792563
b1_p1_h9;От троицы только и осталось по хуторским дворам: сухой чабрец, рассыпанный на полах, пыль мятых листьев да морщиненная, отжившая зелень срубленных дуб;0.04300694692700317
b2_p8_h8;Первую бригаду одной из пехотных дивизий, находившуюся в резерве Юго-Западного фронта, с приданным к ней 27-м Донским казачьим полком, перед Февральск;0.07996825244584983
b1_p3_h4;На площади серая густела толпа. В рядах — лошади, казачья справа, мундиры с разными номерами погонов. На голову выше армейцев-казаков, как гуси голлан;0.1701278557940363
b1_p2_h18;У соседки Коршуновых Пелагеи в ночь под субботу на страстной неделе собрались бабы на посиделки. Гаврила Майданников — муж Пелагеи — писал из Лодзи, с;0.010883081178038007
b3_p38_h38;Полой водой взбугрилось и разлилось восстание, затопило все Обдонье, задонские степные края на четыреста верст в окружности. Двадцать пять тысяч казак;0.017382841911489363
b1_p3_h15;"Дивизия получила задание форсировать реку Стырь и около Ловишчей выйти противнику в тыл.
Листницкий за несколько дней сжился с офицерским составом пол";0.010446133524601216
b1_p3_h16;"Вместе со второй очередью ушла и третья. Станицы, хутора на Дону обезлюдели, будто на покос, на страду вышла вся Донщина.
На границах горькая разгорал";0.04865872462013188
b1_p3_h5;В последних числах июня полк выступил на маневры. По распоряжению штаба дивизии полк походным порядком прошел до города Ровно. В окрестностях его разв;0.03235650985458852
b1_p1_h11;За хутором Сетраковым в степи рядами вытянулись повозки с брезентовыми будками. Невидимо быстро вырос городок, белокрыший и аккуратный, с прямыми улоч;0.030541029317368025
b1_p1_h3;"Григорий пришел с игрищ после первых кочетов. Из сенцев пахнуло на него запахом перекисших хмелин и пряной сухменью богородицыной травки.
На цыпочках ";0.0188114398858222
b1_p3_h17;Мелеховы на двенадцатый день после известия о смерти Григория получили от Петра два письма сразу. Дуняшка еще на почте прочитала их и — то неслась к д;0.10559738976855379
