name;short_text;prob2_0
b3_p13_h13;Пугающие тишиной, короткие дни под исход казались большими, как в страдную пору. Полегли хутора глухой целинной степью. Будто вымерло все Обдонье, буд;0.000232159696231941
b1_p3_h7;Обычно из верховских станиц Донецкого округа — Еланской, Вешенской, Мигулинской и Казанской — брали казаков в 11-й — 12-й армейские казачьи полки и в ;0.0003362830075078739
b2_p9_h9;Через сутки полк был уже неподалеку от фронта. На узловой станции эшелоны остановили. Вахмистры разнесли приказ: «Выгружаться!» Торопливо сводили каза;0.004643908545918637
b2_p14_h14;За день до приезда Корнилова в Москву есаул Листницкий прибыл туда с поручением особой важности от Совета союза казачьих войск. Передав в штаб находив;0.015657934677660565
b1_p3_h19;Война и из Ягодного повыдергала людей. Ушли Вениамин и Тихон, после них стало еще глуше, тише, скучнее. Вместо Вениамина прислуживала старому генералу;0.0025716832547697482
b1_p1_h23;Коршуновы приехали уже после того, как жениха с невестой увезли в церковь. Пантелей Прокофьевич до этого выходил за ворота, взглядывался вдоль улицы, ;0.0010383992569585462
b1_p3_h3;Над степью — желтый солнечный зной. Желтой пылью дымятся нескошенные вызревшие заливы пшеницы. К частям косилки не притронуться рукой. Вверх не поднят;0.006067063840360854
b1_p2_h6;С давних пор велось так: если по дороге на Миллерово ехал казак один, без товарищей, то стоило ему при встрече с украинцами (слободы их начинались от ;0.011781819760506395
b2_p20_h20;Теплилась осень. Перепадали дожди. Над Быховом редко показывалось обескровленное солнце. В октябре начался отлет дикой птицы. Даже ночами звенел над п;0.013675335055275345
b1_p1_h12;"Оставалось полторы недели до прихода казаков из лагерей.
Аксинья неистовствовала в поздней горькой своей любви. Несмотря на угрозы отца, Григорий, тая";0.0014605120167572362
b1_p2_h10;На пологом песчаном левобережье, над Доном, лежит станица Вешенская, старейшая из верховых донских станиц, перенесенная с места разоренной при Петре I;0.00040598207024722984
b2_p22_h22;Полая вода только что начала сбывать. На лугу, около огородных плетней, оголилась бурая, илистая земля, каймой лежал наплав: оставшиеся от разлива обл;0.0003664188469735946
b2_p30_h30;"Отряд татарских казаков под командой хорунжего Петра Мелехова прибыл в хутор Пономарев 11 мая на рассвете.
По хутору сновали казаки-чирцы, вели на вод";0.0027334271462747662
b3_p25_h25;Кошевой, задумчиво похлопывая плеткой по голенищу, уронив голову, медленно всходил по порожкам моховского дома. Около дверей в коридоре, прямо на полу;0.007976714106366255
b1_p1_h2;Редкие в пепельном рассветном небе зыбились звезды. Из-под туч тянул ветер. Над Доном на дыбах ходил туман и, пластаясь по откосу меловой горы, сполза;0.0018272755484783645
b3_p4_h4;15 мая атаман Всевеликого войска Донского Краснов, сопутствуемый председателем совета управляющих, управляющим отделом иностранных дел генерал-майором;0.000895940018081885
b4_p6_h6;Тотчас же, как только в Вешенской стало известно о спешном отступлении красных частей, Григорий Мелехов с двумя конными полками вплавь переправился че;0.00026921935314693955
b3_p34_h34;На заре разведка, посланная к Красному яру, вернулась с известием, что красных не обнаружено до Еланской грани и что Петро Мелехов с десятью казаками ;0.003606002981136196
b3_p1_h1;"Как ты, батюшка, славный тихий Дон,
Ты кормилец наш, Дон Иванович,
Про тебя лежит слава добрая,
Слава добрая, речь хорошая,
Как, бывало, ты все быстер";0.022492262071581053
b2_p11_h11;Назначение генерала Корнилова главнокомандующим Юго-Западного фронта встречено было офицерским составом 14-го полка с большим сочувствием. О нем говор;0.0018916471238553411
b1_p2_h21;"К просторному суходолу наростом прилипло имение Листницкого — Ягодное. Меняясь, дул ветер то с юга, то с севера; плыло в синеватой белизне неба солнце";0.001825941191268372
b4_p19_h19;"Небо заволокло тучами. Накрапывал мелкий, будто сквозь сито сеянный, дождь. Молодая отава, бурьяны, раскиданные по степи кусты дикого терна блестели.
";0.0009216775578084875
b1_p2_h12;Аксинья отстряпалась рано, загребла жар, закутала трубу и, перемыв посуду, выглянула в оконце, глядевшее на баз. Степан стоял возле слег, сложенных ко;0.009738118114569594
b1_p3_h1;В марте 1914 года в ростепельный веселый день пришла Наталья к свекру. Пантелей Прокофьевич заплетал пушистым сизым хворостом разломанный бугаем плете;0.00022570643789770879
b1_p3_h18;Выметываясь из русла, разбивается жизнь на множество рукавов. Трудно предопределить, по какому устремит она свой вероломный и лукавый ход. Там, где ны;0.00164923039070103
b1_p1_h7;"Аксинью выдали за Степана семнадцати лет. Взяли ее с хутора Дубровки, с той стороны Дона, с песков.
За год до выдачи осенью пахала она в степи, верст ";0.001085975663469813
b2_p21_h21;Полк отступал вторые сутки. Медленно, с боями, но отступал. По возвышенным грунтовым дорогам тянулись обозы русской и румынской армий. Объединенные ав;0.0016653104428921049
b2_p28_h28;На западе густели тучи. Темнело. Где-то далеко-далеко, в полосе Обдонья, вилась молния, крылом недобитой птицы трепыхалась оранжевая зарница. В той ст;0.0008125030709213895
b2_p10_h10;По возвращении из отпуска есаул Евгений Листницкий получил назначение в 14-й Донской казачий полк. В свой полк, в котором служил раньше и из которого ;0.010207210980486856
b3_p31_h31;В Вешенской к красному кирпичному зданию исполкома резво подкатила тачанка, конвоируемая двумя конными казаками. В задке полулежал Лихачев. Он встал, ;0.008508354483358096
b4_p21_h21;Мелеховская семья за один год убавилась наполовину. Прав был Пантелей Прокофьевич, сказав однажды, что смерть возлюбила их курень. Не успели похоронит;0.00015498012467591256
b1_p3_h13;Операция по захвату города началась рано утром. Пехотные части, имея на флангах и в резерве кавалерию, должны были повести наступление от леса с рассв;0.005089227676053149
b1_p3_h11;Небольшая в сафьяновом, цвета под дуб, переплете записная книжка. Углы потерты и заломлены: долго носил хозяин в кармане. Листки исписаны узловатым ко;0.00034840970183731737
b1_p3_h2;Где-то позади, в сером слизистом тумане осталась длинная дорога от Маньково-Калитвенской слободы до местечка Радзивиллово. Пытался Григорий вспомнить ;0.0012323855039391679
b2_p17_h17;Кинутые на Петроград части 3-го конного корпуса и Туземной дивизии эшелонировались на огромном протяжении восьми железных дорог: Ревель, Везенберг, На;0.0003400880793547403
b1_p3_h22;На Юго-Западном фронте в районе Шевеля командование армии решило грандиозной кавалерийской атакой прорвать фронт противника и кинуть в тыл ему большой;0.0009247682245327949
b1_p1_h18;Коршуновы слыли первыми богачами в хуторе Татарском. Четырнадцать пар быков, косяк лошадей, матки с Провальских заводов, полтора десятка коров, пропас;0.0007642682499434197
b1_p1_h20;"Всходит остролистая зеленая пшеница, растет; через полтора месяца грач хоронится в ней с головой, и не видно; сосет из земли соки, выколосится; потом ";0.0012713364370367185
b3_p16_h16;"Далеко за Доном — время перевалило уже за обед — пулемет глухо выщелкал две очереди и смолк.
Через полчаса Григорий, не отходивший от окна в горнице, ";0.00045934816716440796
b1_p2_h11;Наутро Григорий отправился к Мохову в дом. Сергей Платонович пришел из магазина к чаю. Сидел с Атепиным в столовой, оклеенной дорогими, под дуб, обоям;0.008734064176042257
b1_p2_h20;На шестом месяце, когда скрывать беременность было уже нельзя, Аксинья призналась Григорию. Она скрывала, боясь, что Григорий не поверит в то, что его;0.00306896921274408
b3_p21_h21;Снег падал и таял на лету. В полдень в ярах с глухим шумом рушились снежные оползни. За Доном шумел лес. Стволы дубов оттаяли, почернели. С ветвей сры;0.0021841211356284688
b1_p1_h16;Только после того как узнал от Томилина про Аксинью, понял Степан, вынашивая в душе тоску и ненависть, что, несмотря на плохую жизнь с ней, на ту давн;0.003270331783956728
b4_p3_h3;"Поздно ночью Григорий пришел из штаба на квартиру. Прохор Зыков ожидал его у калитки.
— Про Аксинью не слышно? — спросил Григорий с деланным равнодуши";0.0005163012166274474
b1_p2_h2;В конце августа Митька Коршунов случайно встретился возле Дона с дочерью Сергея Платоновича Елизаветой. Он только что приехал из-за Дона и, примыкая к;0.0013145365194700005
b2_p12_h12;В сотне Листницкого был казак Букановской станицы Лагутин Иван. По первым выборам он прошел в члены полкового Военно-революционного комитета, до прихо;0.005711174226386443
b1_p1_h5;До хутора Сетракова — места лагерного сбора — шестьдесят верст. Петро Мелехов и Астахов Степан ехали на одной бричке. С ними еще трое казаков-хуторян:;0.004377786229948533
b3_p29_h29;На рассвете, измученный, Кошевой въехал в хутор Большой Усть-Хоперской станицы. Его остановила застава 4-го Заамурского полка. Двое красноармейцев отв;0.011506111538309048
b1_p1_h1;Мелеховский двор — на самом краю хутора. Воротца со скотиньего база ведут на север к Дону. Крутой восьмисаженный спуск меж замшелых в прозелени меловы;0.0006244267798656356
b1_p2_h14;Сотник Евгений Листницкий служил в лейб-гвардии Атаманском полку. На офицерских скачках разбился, переломил в предплечье левую руку. После лазарета вз;0.0007528850775952951
b3_p24_h24;Из глубоких затишных омутов сваливается Дон на россыпь. Кучеряво вьется там течение. Дон идет вразвалку, мерным тихим разливом. Над песчаным твердым д;0.0002240293298757145
b2_p13_h13;6 августа начальник штаба верховного главнокомандующего генерал Лукомский, через первого генерал-квартирмейстера Ставки генерала Романовского, получил;0.014516583414806834
b3_p23_h23;"Петро только что наметал скотине и вошел в курень, выбирая из варежек сенные остья. Сейчас же звякнула щеколда в сенцах.
Закутанная в черный ковровый ";0.004896884999444535
b2_p29_h29;В ночь эту, обрызганную молочным светом бледно-желтых звезд, в лавчушке, набитой людьми до отказа, почти не было сна. Короткие гасли разговоры. Духота;0.004630248526197756
b2_p7_h7;Маленькими смуглыми руками, покрытыми редким глянцем волоса, щупал Сергей Платонович Мохов жизнь со всех сторон. Иногда и она с ним заигрывала, иногда;0.00048395366992012113
b3_p6_h6;Вызрел ковыль. Степь на многие версты оделась колышущимся серебром. Ветер упруго приминал его, наплывая, шершавил, бугрил, гнал то к югу, то к западу ;0.0006566370042343589
b4_p16_h16;Несколько дней после разговора с Дарьей Наталья жила, испытывая такое ощущение, какое бывает во сне, когда тяжко давит дурной сон и нет сил очнуться. ;0.0003197628840681375
b3_p7_h7;"По линии Филоново — Поворино выравнивался фронт. Красные стягивали силы, копили кулак для удара. Казаки вяло развивали наступление; испытывая острую н";0.00017531786912369123
b4_p10_h10;"На рассвете его разбудил Копылов.
— Вставай, пора собираться, ехать! Приказано ведь быть к шести часам.
Начальник штаба только что побрился, вычистил ";0.0022669347230387235
b2_p15_h15;В версте от развалин местечка, стертого орудийным огнем июньских боев, возле леса причудливо вилюжились зигзаги окопов. Участок у самой опушки занимал;0.0003587277065338499
b2_p23_h23;После ухода Кошевого казаки сидели некоторое время молча. Над хутором шатался набатный гуд, мелко дребезжали оконца хаты. Иван Алексеевич смотрел в ок;0.0002672523275886074
b1_p3_h23;"К глазной лечебнице доктора Снегирева примыкал маленький садик.
Таких неуютных стриженых садов много по окраинным переулкам Москвы, в них не отдыхает ";0.0016667432285103324
b4_p11_h11;Казачьи сотни четвертый раз вставали из неглубоких окопов и под убийственным пулеметным огнем красных залегали снова. Красноармейские батареи, укрытые;0.0013626970324656126
b1_p2_h9;"Вечером у косой Лукешки в половине Штокмана собирался разный люд; приходил Христоня, с мельницы Валет в накинутом на плечи замасленном пиджаке; скалоз";0.001460622838063855
b3_p35_h35;Приказом командующего объединенными повстанческими силами Верхнего Дона Григорий Мелехов назначен был командиром Вешенского полка. Десять сотен казако;0.004946053747839286
b2_p1_h1;Тысяча девятьсот шестнадцатый год. Октябрь. Ночь. Дождь и ветер. Полесье. Окопы над болотом, поросшим ольхой. Впереди проволочные заграждения. В окопа;0.004399770747833289
b3_p2_h2;С Дона через Украину катились красные составы вагонов, увозя в Германию пшеничную муку, яйца, масло, быков. На площадках стояли немцы в бескозырках, в;7.728681938760442e-05
b4_p22_h22;Четырнадцать изловленных дезертиров ждали суда. Суд был короткий и немилостивый. Престарелый есаул, председательствовавший на заседаниях, спрашивал у ;0.00170727949117671
b2_p27_h27;Несколько дней экспедиция шла в глубь Донецкого округа, прорываясь к Краснокутской станице. Население украинских слобод встречало отряд с неизменным р;0.0005982005177503459
b4_p1_h1;Верхнедонское восстание, оттянувшее с Южного фронта значительное количество красных войск, позволило командованию Донской армии не только свободно про;0.0002191635608824181
b3_p37_h37;Весна отворяла жилы рек. Ядренее становились дни, звучнее нагорные зеленые потоки. Солнце приметно порыжело, слиняла на нем немощно-желтая окраска. Ос;0.001652311180122702
b1_p2_h19;"Степан подошел к Григорию и, ухватившись за стремя, плотно прижался к потному боку жеребца.
— Ну, здорово, Григорий!
— Слава богу.
— Что ж ты думаешь?";0.004746106769916858
b1_p3_h10;Фронт еще не улегся многоверстной неподатливой гадюкой. На границе вспыхивали кавалерийские стычки и бои. В первые дни после объявления войны германск;0.000768595668112873
b4_p25_h25;Через месяц Григорий выздоровел. Впервые поднялся он с постели в двадцатых числах ноября и — высокий, худой, как скелет, — неуверенно прошелся по комн;0.00011940272647970164
b1_p2_h17;"Григорий вернулся из Миллерова, куда отвозил Евгения, в вербное воскресенье. Оттепель съела снег; дорога испортилась в каких-нибудь два дня.
В Ольхово";0.004742722446809099
b4_p7_h7;Генерала Секретева, приехавшего в Вешенскую со штабными офицерами и сотней казаков личного конвоя, встречали хлебом-солью, колокольным звоном. В обеих;0.0011573263338852642
b2_p24_h24;В Каргинскую приехали перед вечером. В станице уже не было фронтовиков — ушли на Мигулинскую. Петро, спешив свой отряд на площади, возле магазина купц;0.0004505500067210754
b3_p9_h9;И после, когда полк вступил в полосу непрерывных боев, когда вместо завес уже лег изломистой вилюжиной фронт, Григорий всегда, сталкиваясь с неприятел;0.00027685094487357015
b4_p12_h12;Дня через три после отъезда Григория явился в хутор Татарский Митька Коршунов. Приехал он не один, его сопровождали двое сослуживцев по карательному о;5.452952998071776e-05
b3_p18_h18;Фронт прошел. Отгремели боевые деньки. В последний день пулеметчики 13-го кавполка перед уходом поставили на широкоспинные тавричанские сани моховский;0.001407783511165574
b4_p13_h13;Удивительно, как изменилась жизнь в семье Мелеховых! Совсем недавно Пантелей Прокофьевич чувствовал себя в доме полновластным хозяином, все домашние е;0.00018531519768226167
b1_p2_h7;Зима легла не сразу. После покрова стаял выпавший снег, и табуны снова выгнали на подножный. С неделю тянул южный ветер, теплело, отходила земля, ярко;0.000620477030962644
b1_p3_h6;Казаки-второочередники с хутора Татарского и окрестных хуторов на второй день после выступления из дому ночевали на хуторе Ея. Казаки с нижнего конца ;0.0016167940886678066
b3_p30_h30;В Татарском в день приезда Григория уже сформировались две сотни казаков. На сходе постановили мобилизовать всех способных носить оружие, от шестнадца;0.0030110270157198546
