name;short_text;prob2_0
vskr_101;Нехлюдов, еще не выходя из вагона, заметил на дворе станции несколько богатых экипажей, запряженных четвернями и тройками сытых, побрякивающих бубенца;0.00013056319729139518
vskr_9;"Окончив свою речь, председатель обратился к подсудимым.
- Симон Картинкин, встаньте, - сказал он.
Симон нервно вскочил. Мускулы щек зашевелились еще б";0.0008555676250720438
vskr_103;Подойдя к месту шума, Марья Павловна и Катюша увидали следующее: офицер, плотный человек с большими белокурыми усами, хмурясь, потирал левою рукой лад;0.003964699679180845
vskr_100;"Вагон, в котором было место Нехлюдова, был до половины полон народом.
Были тут прислуга, мастеровые, фабричные, мясники, евреи, приказчики, женщины, ж";0.00010247375454794736
vskr_74;"Граф Иван Михайлович был отставной министр и человек очень твердых убеждений.
Убеждения графа Ивана Михайловича с молодых лет состояли в том, что как ";0.000109137265614505
vskr_119;Когда Нехлюдов вернулся вслед за Катюшей в мужскую камеру, там все были в волнении. Набатов, везде ходивший, со всеми входивший в сношения, все наблюд;0.0009128647182934815
vskr_24;"Предположения Петра Герасимовича были справедливы.
Вернувшись из совещательной комнаты, председатель взял бумагу и прочел:
- «188* года апреля 28 дня,";0.0003928148873601305
vskr_104;После развратной, роскошной и изнеженной жизни последних шести лет в городе и двух месяцев в остроге с уголовными жизнь теперь с политическими, несмот;0.0005224658883595198
vskr_44;При первом свидании Нехлюдов ожидал, что, увидав его, узнав его намерение служить ей и его раскаяние, Катюша обрадуется и умилится и станет опять Катю;0.0004905681970305913
vskr_4;Напившись кофею, Нехлюдов пошел в кабинет, чтобы справиться в повестке, в котором часу надо быть в суде, и написать ответ княжне. В кабинет надо было ;0.00029837549933035167
vskr_97;Когда Нехлюдов приехал на вокзал, арестанты уже все сидели в вагонах за решетчатыми окнами. На платформе стояло несколько человек провожавших: их не п;0.0008051634177531679
vskr_19;В таком душевном настроении находился Нехлюдов, выйдя из залы суда в комнату присяжных. Он сидел у окна, слушая разговоры, шедшие вокруг него, и не пе;0.001042103332604844
vskr_124;- Ну-с, так вот что: вы у кого? у Дюка? Ну, и там скверно. А вы приходите обедать, - сказал генерал, отпуская Нехлюдова, - в пять часов. Вы по-английс;0.0003677963229133965
vskr_87;Нехлюдов уехал бы в тот же день вечером, но он обещал Mariette быть у нее в театре, и хотя он знал, что этого не надо было делать, он все-таки, кривя ;0.00026869049306956573
vskr_47;"Нехлюдов уже давно дожидался в сенях. Приехав в острог, он позвонил у входной двери и Подал дежурному надзирателю разрешение прокурора.
- Вам кого?
- ";0.0017569459621411302
vskr_67;Вернувшись домой, Нехлюдов нашел в приготовленной для его ночлега конторе высокую постель с пуховиками, двумя подушками и красным-бордо двуспальным ше;0.000155100106365867
vskr_99;Жара в накаленном в продолжение целого дня солнцем и полном народа большом вагоне третьего класса была такая удушливая, что Нехлюдов не пошел в вагон,;0.000300224107439553
vskr_48;"Надзиратель, приведший Маслову, присел на подоконник поодаль от стола.
Для Нехлюдова наступила решительная минута. Он не переставая упрекал себя за то";0.000742210985581588
vskr_120;На дворе вызвездило. Вернувшись по закованной, только еще кое-где просовывающейся грязи на свой постоялый двор, Нехлюдов постучал в темное окно, и шир;0.00021288713246449294
vskr_34;Приехав в суд, Нехлюдов в коридоре еще встретил вчерашнего судебного пристава и расспросил его, где содержатся приговоренные уже по суду арестанты и о;0.0003339531195683229
vskr_115;"Рассчитывая поговорить отдельно с Катюшей, как он делал это обыкновенно после общего чая и ужина, Нехлюдов сидел подле Крыльцова, беседуя с ним.
Между";0.0012749415470144454
vskr_95;Нехлюдов шел тем же скорым шагом, которым шли арестанты, но и легко одетому, в легком пальто ему было ужасно жарко, главное - душно от пыли и неподвиж;0.0034483000005167065
vskr_54;Контора состояла из двух комнат. В первой комнате, с большой выступающей облезлой печью и двумя грязными окнами, стояла в одном углу черная мерка для ;0.003971346072811351
vskr_83;Выйдя из сената, Нехлюдов с адвокатом пошли вместе по тротуару. Карете своей адвокат велел ехать за собой и начал рассказывать Нехлюдову историю того ;2.509906689367569e-05
vskr_12;"Да, это была Катюша.
Отношения Нехлюдова к Катюше были вот какие.
В первый раз увидал Нехлюдов Катюшу тогда, когда он на третьем курсе университета, г";0.00018393932900426894
vskr_117;В соседней камере послышались голоса начальства. Все затихло, и вслед за этим вошел старшой с двумя конвойными. Это была поверка. Старшой счел всех, у;0.0004502712799509225
vskr_23;Наконец председатель кончил свою речь и, грациозным движением подняв вопросный лист, передал его подошедшему к нему старшине. Присяжные встали, радуяс;8.6326924715505e-05
vskr_63;Выйдя за ворота, Нехлюдов встретил на твердо убитой тропинке, по поросшему подорожником и клоповником выгону, быстро перебиравшую толстыми босыми нога;0.00027794478034600897
vskr_35;Как только сделан был первый перерыв, Нехлюдов встал и вышел в коридор с намерением уже больше не возвращаться в суд. Пускай с ним делают, что хотят, ;0.0021470448310324957
vskr_75;"Вспоминая улыбку, которою он обменялся с Mariette, Нехлюдов покачал на себя головою.
«Не успеешь оглянуться, как втянешься опять в эту жизнь», - подум";0.00017254190824673543
vskr_20;Но, как назло ему, дело тянулось долго: после допроса поодиночке свидетелей и эксперта и после всех, как обыкновенно, делаемых с значительным видом не;0.0002165365476541191
vskr_122;Нехлюдов стоял у края парома, глядя на широкую быструю реку. В воображении его, сменяясь, восставали два образа: вздрагивающая от толчков голова в озл;0.0005938540527179131
vskr_52;"- Можно поглядеть? - спросил Нехлюдов.
- Сделайте одолжение, - с приятной улыбкой сказал помощник и стал что-то спрашивать у надзирателя. Нехлюдов заг";0.0011846506567963276
vskr_51;В тот же день прямо от Масленникова приехав в острог, Нехлюдов направился к знакомой уже квартире смотрителя. Опять слышались те же, как и в тот раз, ;0.0019143838174213858
vskr_58;"- Ну-с, je suis a vous. Хочешь курить?
Только постой, как бы нам тут не напортить, - сказал он и принес пепельницу.
- Ну-с?
- У меня к тебе два дела.
";0.00105939948903869
vskr_36;"От прокурора Нехлюдов поехал прямо в дом предварительного заключения.
Но оказалось, что никакой Масловой там не было, и смотритель объяснил Нехлюдову,";0.0009112888632368682
vskr_93;Партия, в которой шла Маслова, отправлялась с вокзала в три часа, и потому, чтобы видеть выход партии из острога и с ней вместе дойти до вокзала желез;0.0002590318989801136
vskr_112;Помещение политических состояло из двух маленьких камер, двери которых выходили в отгороженную часть коридора. Войдя в отгороженную часть коридора, пе;0.00016780603157196927
vskr_85;"- Да, для молодых это одиночное заключение ужасно, - сказала тетка, покачивая головой и тоже закуривая папиросу.
- Я думаю, для всех, - сказал Нехлюдо";0.0011248423639996618
vskr_32;"Маслова достала из калача же деньги и подала Кораблевой купон.
Кораблева взяла купон, посмотрела и, хотя не знала грамоте, поверила все знавшей Хороша";0.0004350611112982005
vskr_76;Обедали у графини Катерины Ивановны в половине восьмого, и обед подавался по новому, еще не виданному Нехлюдовым способу. Кушанья ставились на стол, и;0.00025605011079159076
vskr_25;"Разговор с председателем и чистый воздух несколько успокоили Нехлюдова.
Он подумал теперь, что испытываемое им чувство было им преувеличено вследствие";0.001621977899555081
vskr_91;Вернувшись домой и найдя у себя на столе записку сестры, Нехлюдов тотчас же поехал к ней. Это было вечером. Игнатий Никифорович отдыхал в другой комна;0.000420167105861658
vskr_114;Печка истопилась, согрелась, чай был заварен и разлит по стаканам и кружкам и забелен молоком, были выложены баранки, свежий ситный и пшеничный хлеб, ;0.0009766771517307608
