name;short_text;prob2_0
vskr_121;Когда Нехлюдов проснулся, извозчики уже давно съехали, хозяйка напилась чаю и, отирая платком потную толстую шею, пришла сказать, что этапный солдат п;0.000367463925361341
vskr_88;Приехав в Москву, Нехлюдов первым делом поехал в острожную больницу объявить Масловой печальное известие о том, что сенат утвердил решение суда и что ;0.00038414083142661055
vskr_107;В особенности полюбил Нехлюдов шедшего с той партией, к которой была присоединена Катюша, ссылаемого в каторгу чахоточного молодого человека Крыльцова;0.0006297744884638883
vskr_26;- Пожалуйте, ваше сиятельство, ожидают, - сказал ласковый жирный швейцар большою дома Корчагиных, отворяя бесшумно двигавшуюся на английских петлях ду;0.00021937277613580494
vskr_109;Полуэтап был расположен так же, как и все этапы и полуэтапы по сибирской дороге: во дворе, окруженном завостренными бревнами-палями, было три одноэтаж;0.0010387527471377427
vskr_5;"В коридорах суда уже шло усиленное движение, когда Нехлюдов вошел в него.
Сторожа то быстро ходили, то рысью даже, не поднимая ног от пола, но шмыгая ";0.0004826145976753959
vskr_72;С замиранием сердца и ужасом перед мыслью о том, в каком состоянии он нынче найдет Маслову, и той тайной, которая была для него и в ней и в том соедин;0.00022983529120073197
vskr_78;Человек, от которого зависело смягчение участи заключенных в Петербурге, был увешанный орденами, которые он не носил, за исключением белого креста в п;0.00028372259224698223
vskr_92;"- Ну, что дети? - спросил Нехлюдов у сестры, немного успокоившись.
Сестра рассказала про детей, что они остались с бабушкой, с его матерью, и, очень д";0.0004425579009050635
vskr_129;Не ложась спать, Нехлюдов долго ходил взад и вперед по номеру гостиницы. Дело его с Катюшей было кончено. Он был ненужен ей, и ему это было и грустно ;0.00023169843513820167
vskr_69;Город особенно странно и по-новому в этот приезд поразил Нехлюдова. Он вечером, при зажженных фонарях, приехал с вокзала в свою квартиру. По всем комн;0.00033289011006796615
vskr_102;Партия, с которой шла Маслова, прошла около пяти тысяч верст. До Перми Маслова шла по железной дороге и на пароходе с уголовными, и только в этом горо;0.00037255887443371895
vskr_30;Камера, в которой содержалась Маслова, была длинная комната, в девять аршин длины и семь ширины, с двумя окнами, выступающею облезлой печкой и нарами ;0.0002484153094425868
vskr_16;Вернувшись из церкви, Нехлюдов разговелся с тетушками и, чтобы подкрепиться, по взятой в полку привычке, выпил водки и вина и ушел в свою комнату и то;0.0007567764755069497
vskr_56;Разговор их был прерван смотрителем, который поднялся и объявил, что время свидания кончилось и надо расходиться. Нехлюдов встал, простился с Верой Еф;0.0017623189638393325
vskr_7;Наконец приехал и Матвей Никитич, и судебный пристав, худой человек с длинной шеей и походкой набок и также набок выставляемой нижней губой, вошел в к;0.00029703125273684996
vskr_126;Мрачный дом острога с часовым и фонарем под воротами, несмотря на чистую, белую пелену, покрывавшую теперь все - и подъезд, и крышу, и стены, производ;0.000848766540639958
vskr_71;До острога было далеко, а было уже поздно, и потому Нехлюдов взял извозчика и поехал к острогу. На одной из улиц извозчик, человек средних лет, с умны;0.0020337887838753036
vskr_96;"Подъехав к части мимо пожарного часового, пролетка с арестантом въехала во двор полицейской части и остановилась у одного из подъездов.
На дворе пожар";0.0005974626147280627
vskr_33;Первое чувство, испытанное Нехлюдовым на другой день, когда он проснулся, было сознание того, что с ним что-то случилось, и прежде даже чем он вспомни;0.0008717599305830719
vskr_66;Над толпой у двора старосты стоял говор, но как только Нехлюдов подошел, говор утих, и крестьяне, так же как и в Кузминском, все друг за другом посним;0.000607440668947636
vskr_118;- А, каково? - сказала Марья Павловна. - Влюблен, совсем влюблен. Вот уж чего никогда не ожидала бы, чтобы Владимир Симонсон влюбился таким самым глуп;0.0008126081605332027
vskr_17;Так прошел весь вечер, и наступила ночь. Доктор ушел спать. Тетушки улеглись. Нехлюдов знал, что Матрена Павловна теперь в спальне у теток и Катюша в ;0.001038605164886633
vskr_2;История арестантки Масловой была очень обыкновенная история. Маслова была дочь незамужней дворовой женщины, жившей при своей матери-скотнице в деревне;0.0001940735824683105
vskr_86;Последнее дело, задержавшее Нехлюдова в Петербурге, было дело сектантов, прошение которых на имя царя он намеревался подать через бывшего товарища по ;0.0003762583968514654
vskr_14;Нехлюдов заехал к тетушкам потому, что имение их было по дороге к прошедшему вперед его полку, и потому, что они его очень об этом просили, но, главно;0.0007163389006911681
vskr_108;В тот день, когда на выходе с этапа произошло столкновение конвойного офицера с арестантами из-за ребенка, Нехлюдов, ночевавший на постоялом дворе, пр;0.001541008773779743
vskr_59;Одно из самых обычных и распространенных суеверий то, что каждый человек имеет одни свои определенные свойства, что бывает человек добрый, злой, умный;0.0010949698544301008
vskr_127;Пройдя сени и до тошноты вонючий коридор, в котором, к удивлению своему, они застали двух прямо на пол мочащихся арестантов, смотритель, англичанин и ;0.0023992419071788
vskr_64;Нехлюдову было легче с мальчиками, чем с большими, и он дорогой разговорился с ними. Маленький в розовой рубашке перестал смеяться и говорил так же ум;0.001511457543584433
vskr_57;На другой день Нехлюдов поехал к адвокату и сообщил ему дело Меньшовых, прося взять на себя защиту. Адвокат выслушал и сказал, что посмотрит дело, и е;0.00030611298361379294
vskr_80;"Как только сенаторы сели за стол совещательной комнаты, Вольф стал очень оживленно выставлять мотивы, по которым дело должно было быть кассировано.
Пр";0.0006162237225653854
vskr_22;После последнего слова обвиняемых и переговоров сторон о форме постановки вопросов, продолжавшихся еще довольно долго, вопросы были поставлены, и пред;0.00038127398402459744
vskr_62;Из Кузминского Нехлюдов поехал в доставшееся ему по наследству от тетушек имение - то самое, в котором он узнал Катюшу. Он хотел и в этом имении устро;0.000449378174636856
vskr_65;Ударившись еще раз головой об обе двери в избе и в сенях, Нехлюдов вышел на улицу. Ребята: белый, дымчатый, и розовый дожидались его. Еще несколько но;0.0003565148436208089
vskr_77;На другой день, только что Нехлюдов оделся и собирался спуститься вниз, как лакей принес ему карточку московского адвоката. Адвокат приехал по своим д;0.0010259126452155495
vskr_73;В Петербурге у Нехлюдова было три дела: кассационное прошение Масловой в сенате, дело Федосьи Бирюковой в комиссии прошений и, по поручению Веры Богод;0.0005708611999553444
vskr_68;"К утру только Нехлюдов заснул и потому на другой день проснулся поздно.
В полдень семь выбранных мужиков, приглашенных приказчиком, пришли в яблочный ";0.00042263696821798777
vskr_43;Маслова оглянулась и, подняв голову и прямо выставляя грудь, с своим, знакомым Нехлюдову, выражением готовности, подошла к решетке, протискиваясь межд;0.0005515414533728119
vskr_105;"Влияние Марьи Павловны было одно влияние, которому подчинялась Маслова.
Оно происходило оттого, что Маслова полюбила Марью Павловну. Другое влияние бы";0.0002887974408491028
vskr_39;"Началось богослужение.
Богослужение состояло в том, что священник, одевшись в особенную, странную и очень неудобную парчовую одежду, вырезывал и раскл";0.0005401803069992704
vskr_15;"Всю жизнь потом эта заутреня осталась для Нехлюдова одним из самых светлых и сильных воспоминаний.
Когда он в черной темноте, кое-где только освещаемо";0.0002206401407109254
vskr_82;Когда Нехлюдов знал Селенина студентом, это был прекрасный сын, верный товарищ и по своим годам хорошо образованный светский человек, с большим так-то;0.0002271320497521737
vskr_46;"В обычное время в остроге просвистели по коридорам свистки надзирателей; гремя железом, отворились двери коридоров и камер, зашлепали босые ноги и каб";0.0006250070737453769
vskr_55;Из задней двери вертлявой походкой вышла маленькая стриженая, худая, желтая Вера Ефремовна, с своими огромными добрыми глазами, - Ну, спасибо, что при;0.0005479729749107954
vskr_125;Несмотря на неудачу в тюрьме, Нехлюдов все в том же бодром, возбужденно-деятельном, настроении поехал в канцелярию губернатора узнать, не получена ли ;0.0001726310562900835
vskr_28;«Стыдно и гадко, гадко и стыдно», - думал между тем Нехлюдов, пешком возвращаясь домой по знакомым улицам. Тяжелое чувство, испытанное им от разговора;0.00026318785163710205
vskr_40;И никому из присутствующих, начиная с священника и смотрителя и кончая Масловой, не приходило в голову, что тот самый Иисус, имя которого со свистом т;0.0002743106669022802
vskr_94;Шествие было так длинно, что когда передние уже скрылись из вида, подводы с мешками и слабыми только тронулись. Когда подводы тронулись, Нехлюдов сел ;0.0003033822128920467
vskr_84;"Первое чувство Нехлюдова, когда он проснулся на другое утро, было то, что он накануне сделал какую-то гадость.
Он стал вспоминать: гадости не было, по";0.000571122138023504
vskr_106;От Нижнего до Перми Нехлюдову удалось видеться с Катюшей только два раза: один раз в Нижнем, перед посадкой арестантов на затянутую сеткой баржу, и др;0.00017185849574933047
vskr_128;В одной из камер ссыльных Нехлюдов, к удивлению своему, увидал того самого странного старика, которого он утром видел на пароме. Старик этот, лохматый;0.0023503178297328373
vskr_81;- Ужасно! - говорил Нехлюдов, выходя в приемную с адвокатом, укладывавшим свой портфель. - В самом очевидном деле они придираются к форме и отказывают;0.002862032250470891
vskr_110;"Провожаемый вестовым, Нехлюдов вышел опять на темный двор, тускло освещаемый красно горевшими фонарями.
- Куда? - спросил встретившийся конвойный у то";0.001242719159178118
vskr_37;Долго еще в эту ночь не могла заснуть Маслова, а лежала с открытыми глазами и, глядя на дверь, заслонявшуюся то взад, то вперед проходившею дьячихой, ;0.0002823981273660634
vskr_49;«Да, так вот оно что. Вот что», - думал Нехлюдов, выходя из острога и только теперь вполне понимая всю вину свою. Если бы он не попытался загладить, и;0.0005729775318182583
vskr_111;Миновав камеру холостых, унтер-офицер, провожавший Нехлюдова, сказал ему, что придет за ним перед поверкой, и вернулся назад. Едва унтер-офицер отошел;0.019266498293473218
vskr_18;На другой день блестящий, веселый Шенбок заехал за Нехлюдовым к тетушкам и совершенно прельстил их своей элегантностью, любезностью, веселостью, щедро;0.000801203177318218
vskr_89;Маслову могли отправить с первой отходящей партией, и потому Нехлюдов готовился к отъезду. Но дел у него было столько, что он чувствовал, что сколько ;0.00016419310862521495
vskr_8;Председатель, просмотрев бумаги, сделал несколько вопросов судебному приставу и секретарю и, получив утвердительные ответы, распорядился о приводе под;0.0005279365272526912
vskr_116;Несмотря на то, что Новодворов был очень уважаем всеми революционерами, несмотря на то, что он был очень учен и считался очень умным, Нехлюдов причисл;0.000518820283317019
vskr_60;Через две недели дело могло слушаться в сенате, и к этому времени Нехлюдов намеревался поехать в Петербург и в случае неудачи в сенате подать прошение;0.0002622715818092749
vskr_45;Нехлюдову хотелось изменить свою внешнюю жизнь: сдать большую квартиру, распустить прислугу и переехать в гостиницу. Но Аграфена Петровна доказала ему;0.00022129729818817382
vskr_42;"«Однако надо делать то, за чем пришел, - сказал он, подбадривая себя. - Как же быть?»
Он стал искать глазами начальство и, увидав невысокого худого че";0.0016024546054259458
vskr_29;Маслова вернулась домой в свою камеру только в шесть часов вечера, усталая и больная ногами после пройденных без привычки пятнадцати верст по камню, у;0.00034889679453032924
vskr_113;Один из вошедших был невысокий сухощавый молодой человек в крытом полушубке и высоких сапогах. Он шел легкой и быстрой походкой, неся два дымящихся бо;0.00031999150388664085
vskr_70;"Адвокат принял Нехлюдова не в очередь и тотчас разговорился о деле Меньшовых, которое он прочел, и был возмущен неосновательностью обвинения.
- Дело э";0.0011406236684453055
vskr_41;"Нехлюдов рано выехал из дома. По переулку еще ехал деревенский мужик и странным голосом кричал:
- Молока, молока, молока!
Накануне был первый теплый в";0.00018581192009563434
vskr_6;Председательствующий приехал в суд рано. Председательствующий был высокий, полный человек с большими седеющими бакенбардами. Он был женат, но вел очен;0.001288045316157622
vskr_123;"Выехав в горку, ямщик обернулся.
- В какую гостиницу везти?
- Какая лучше?
- Чего лучше «Сибирской». А то у Дюкова хорошо.
- Куда хочешь.
Ямщик опять ";0.00031257324219931065
vskr_79;На другой день дело Масловой должно было слушаться, и Нехлюдов поехал в сенат. Адвокат съехался с ним у величественного подъезда сенатского здания, у ;0.00029132545730504566
vskr_90;Отправка партии, в которой шла Маслова, была назначена на 5-е июля. В этот же день приготовился ехать за нею и Нехлюдов. Накануне его отъезда приехала;0.00036158106518923496
vskr_3;В то время когда Маслова, измученная длинным переходом, подходила с своими конвойными к зданию окружного суда, тот самый племянник ее воспитательниц, ;0.00016338420956128963
vskr_13;С тех пор в продолжение трех лет Нехлюдов не видался с Катюшей. И увидался он с нею только тогда, когда, только что произведенный в офицеры, по дороге;0.0003192885895229188
vskr_27;Княгиня Софья Васильевна кончила свой обед, очень утонченный и очень питательный, который она съедала всегда одна, чтобы никто не видал ее в этом непо;0.0003026937966642729
vskr_31;"Когда загремел замок и Маслову впустили в камеру, все обратились к ней.
Даже дочь дьячка на минуту остановилась, посмотрела на вошедшую, подняв брови,";0.0010098744360409783
vskr_1;Как ни старались люди, собравшись в одно небольшое место несколько сот тысяч, изуродовать ту землю, на которой они жались, как ни забивали камнями зем;0.000193171811399255
vskr_98;До отхода пассажирского поезда, с которым ехал Нехлюдов, оставалось два часа. Нехлюдов сначала думал в этот промежуток съездить еще к сестре, но тепер;0.00031045938209489854
vskr_61;На другой день Нехлюдов проснулся в девять часов утра. Молодой конторщик, прислуживавший барину, услыхав, что он шевелится, принес ему ботинки, такие ;0.0006191797613565316
vskr_21;Когда окончился осмотр вещественных доказательств, председатель объявил судебное следствие законченным и без перерыва, желая скорее отделаться, предос;0.0003084980599993201
vskr_53;Проходя назад по широкому коридору (было время обеда, и камеры были отперты) между одетыми в светло-желтые халаты, короткие широкие штаны и коты людьм;0.0015979511269729153
vskr_10;"Обвинительный акт был такой:
- «17 января 188* года в гостинице „Мавритания“ скоропостижно умер приезжий - курганский 2-й гильдии купец Ферапонт Емель";0.0006308159837339376
vskr_50;"Проснувшись на другой день утром, Нехлюдов вспомнил все то, что было накануне, и ему стало страшно.
Но, несмотря на этот страх, он, больше чем когда-н";0.001994234944602482
vskr_11;Когда кончилось чтение обвинительного акта, председатель, посоветовавшись с членами, обратился к Картинкину с таким выражением, которое явно говорило,;0.0009206166251843123
vskr_38;На следующий день, в воскресенье, в пять часов утра, когда в женском коридоре тюрьмы раздался обычный свисток, не спавшая уже Кораблева разбудила Масл;0.0004550095790089728
