name;short_text;prob2_0
Tihiy_Don_145;Кошевой, задумчиво похлопывая плеткой по голенищу, уронив голову, медленно всходил по порожкам моховского дома. Около дверей в коридоре, прямо на полу;0.004660106400466511
Tihiy_Don_111;Полая вода только что начала сбывать. На лугу, около огородных плетней, оголилась бурая, илистая земля, каймой лежал наплав: оставшиеся от разлива обл;4.104129767847944e-05
Tihiy_Don_124;15 мая атаман Всевеликого войска Донского Краснов, сопутствуемый председателем совета управляющих, управляющим отделом иностранных дел генерал-майором;2.570416460446079e-05
Tihiy_Don_130;Цепь дней. Звено, вкованное в звено. Переходы, бои, отдых. Жара. Дождь. Смежные запахи конского пота и нагретой кожи седла. В жилах от постоянного нап;1.964767063104263e-05
Tihiy_Don_198;Удивительно, как изменилась жизнь в семье Мелеховых! Совсем недавно Пантелей Прокофьевич чувствовал себя в доме полновластным хозяином, все домашние е;2.5944922142276514e-05
Tihiy_Don_167;По хутору Бахмуткину гасли последние огни. Легкий морозец тончайшей пленкой льда крыл лужицы. Где-то за хутором, за толокой, на прошлогодней стерне оп;9.77548711966346e-05
Tihiy_Don_1;В предпоследнюю турецкую кампанию вернулся в хутор казак Мелехов Прокофий. Из Туретчины привел он жену - маленькую, закутанную в шаль женщину. Она пря;0.00021734860153190653
Tihiy_Don_85;Кинутые на Петроград части 3-го конного корпуса и Туземной дивизии эшелонировались на огромном протяжении восьми железных дорог: Ревель, Везенберг, На;3.724264251674115e-06
Tihiy_Don_53;Из этого после сделали подвиг. Крючков, любимец командира сотни, по его реляции получил Георгия. Товарищи его остались в тени. Героя отослали в штаб д;0.030847030970326043
Tihiy_Don_97;"С крыш падали пожелтевшие от соломы сосульки, разбивались со стеклянным звоном. В хуторе лужинами и проталинами цвела оттепель; по улицам, принюхиваяс";1.3323232901122171e-05
Tihiy_Don_57;Операция по захвату города началась рано утром. Пехотные части, имея на флангах и в резерве кавалерию, должны были повести наступление от леса с рассв;0.0012502855127038256
Tihiy_Don_52;В местечке Торжок полк разбили по сотням. Шестая сотня, на основании приказа штаба дивизии, была послана в распоряжение Третьего армейского пехотного ;0.00015924733751369747
Tihiy_Don_59;"Дивизия получила задание форсировать реку Стырь и около Ловишчей выйти противнику в тыл.
Листницкий за несколько дней сжился с офицерским составом пол";0.0009911042303948857
Tihiy_Don_40;"Григорий вернулся из Миллерова, куда отвозил Евгения, в вербное воскресенье. Оттепель съела снег; дорога испортилась в каких-нибудь два дня.
В Ольхово";0.0012902698816159338
Tihiy_Don_193;Темны июньские ночи на Дону. На аспидно-черном небе в томительном безмолвии вспыхивают золотые зарницы, падают звезды, отражаясь в текучей быстрине До;2.7219246626382187e-05
Tihiy_Don_113;В Каргинскую приехали перед вечером. В станице уже не было фронтовиков - ушли на Мигулинскую. Петро, спешив свой отряд на площади, возле магазина купц;4.420709050357693e-05
Tihiy_Don_223;Григорию тяжело было встречаться с Кошевым. Отношения их определились с первого дня, и разговаривать им было больше не о чем, да и не к чему. По всей ;0.0005453792712051772
Tihiy_Don_171;"На другой день, перед отъездом Григорий коротко объяснился с Натальей. Она отозвала его в сторону, шепотом спросила:
- Куда ночью ходил? Откель это та";1.7442370650913363e-05
Tihiy_Don_87;В последних числах октября, рано утром, есаул Листницкий получил распоряжение от командира полка - с сотней в пешем строю явиться на Дворцовую площадь;0.001185522997918208
Tihiy_Don_179;22 мая началось отступление повстанческих войск по всему правобережью. Части отходили с боем, задерживаясь на каждом рубеже. Население хуторов степной;4.243432464389483e-05
Tihiy_Don_92;Новочеркасск стал центром притяжения для всех бежавших от большевистской революции. Стекались в низовья Дона большие генералы, бывшие вершители судеб ;0.002042230541687736
Tihiy_Don_103;Наутро Григорий проснулся позже всех. Разбудило его громкое, как весной, чулюканье воробьев под застрехами крыши и за наличниками окон. В щелях ставне;0.00014730386766608234
Tihiy_Don_46;Где-то позади, в сером слизистом тумане осталась длинная дорога от Маньково-Калитвенской слободы до местечка Радзивиллово. Пытался Григорий вспомнить ;0.0002871505400561109
Tihiy_Don_95;25 ноября в полдень к Ростову были стянуты из Новочеркасска войска Каледина. Началось наступление. Вдоль линии железной дороги, по обе стороны насыпи,;0.0015908322294153083
Tihiy_Don_70;"На другой день утром смущенный вахмистр вошел в землянку Листницкого; помявшись, сообщил:
- Нынче утром казаки, ваше благородие, нашли в окопах вот эт";0.0003104772792896721
Tihiy_Don_209;Две с половиной недели Пантелей Прокофьевич благополучно прожил с семьей в хуторе Латышевом и, как только услышал, что красные отступили от Дона, собр;6.129525043793218e-05
Tihiy_Don_137;В полдень через хутор спешным маршем прошел 6-й Мценский краснознаменный полк, захватив кое у кого из казаков строевых лошадей. За бугром далеко погро;0.0006199759723671003
Tihiy_Don_210;Через месяц Григорий выздоровел. Впервые поднялся он с постели в двадцатых числах ноября и - высокий, худой, как скелет, - неуверенно прошелся по комн;3.8026192287670986e-05
Tihiy_Don_191;Тотчас же, как только в Вешенской стало известно о спешном отступлении красных частей, Григорий Мелехов с двумя конными полками вплавь переправился че;6.138149653948557e-05
Tihiy_Don_61;Мелеховы на двенадцатый день после известия о смерти Григория получили от Петра два письма сразу. Дуняшка еще на почте прочитала их и - то неслась к д;0.000745094418175169
Tihiy_Don_159;После бегства из Татарского Штокман, Кошевой, Иван Алексеевич и еще несколько казаков, служивших милиционерами, пристали к 4-му Заамурскому полку. Пол;1.0917911300335866e-05
Tihiy_Don_2;Редкие в пепельном рассветном небе зыбились звезды. Из-под туч тянул ветер. Над Доном на дыбах ходил туман и, пластаясь по откосу меловой горы, сполза;0.00020569340512320897
Tihiy_Don_66;На Юго-Западном фронте в районе Шевеля командование армии решило грандиозной кавалерийской атакой прорвать фронт противника и кинуть в тыл ему большой;0.00025562608666889895
Tihiy_Don_173;Над хутором Сингином Вешенской станицы в апрельский полдень появился аэроплан. Привлеченные глухим рокотом мотора, детишки, бабы и старики выбежали из;0.00034526601251431066
Tihiy_Don_120;Мишка Кошевой и Валет только на вторую ночь вышли из Каргинской. Туман пенился в степи, клубился в балках, ник в падинах, лизал отроги Яров. Опушенные;0.0004668456845587288
Tihiy_Don_15;"- Петру скажи, чтобы запрягал кобылу и своего коня.
Григорий вышел на баз. Петро выкатывал из-под навеса сарая бричку.
- Батя велит запрягать кобылу и";0.00045284662562793083
Tihiy_Don_201;Несколько дней после разговора с Дарьей Наталья жила, испытывая такое ощущение, какое бывает во сне, когда тяжко давит дурной сон и нет сил очнуться. ;4.3390066913421896e-05
Tihiy_Don_6;"Возле лобастого, с желтой песчаной лысиной кургана остановились ночевать.
С запада шла туча. С черного ее крыла сочился дождь. Поили коней в пруду. На";0.0014979401473773728
Tihiy_Don_176;Пленных пригнали в Татарский часов в пять дня. Уже близки были быстротечные весенние сумерки, уже сходило к закату солнце, касаясь пылающим диском кра;2.7496780831176642e-05
Tihiy_Don_228;Весною, когда разливается Дон и полая вода покрывает всю луговую пойму, против хутора Рубежного остается незатопленным небольшой участок высокого лево;7.002195062159331e-05
Tihiy_Don_199;На другой день вернулись с поля косари. Пантелей Прокофьевич решил с обеда начинать возку сена. Дуняшка погнала к Дону быков, а Ильинична и Наталья пр;0.00032729057640668003
Tihiy_Don_86;"31 августа в Петрограде застрелился вызванный туда Керенским генерал Крымов.
С повинной потекли в Зимний дворец делегации и командиры частей крымовско";0.0017655498620940248
Tihiy_Don_117;На западе густели тучи. Темнело. Где-то далеко-далеко, в полосе Обдонья, вилась молния, крылом недобитой птицы трепыхалась оранжевая зарница. В той ст;6.489441800058986e-05
Tihiy_Don_108;С отрядом Голубова, двинувшимся кружным путем для захвата Новочеркасска, выехал и Бунчук. Двадцать третьего февраля они выбрались из Шахтной, прошли с;0.0005538922517865296
Tihiy_Don_226;К заре слегка приморозило. Лужи затянуло сизым ледком. Снег стал жесткий, звучно хрустящий. На зернистой снежной целине копыта лошадей оставляли неясн;8.418807343056338e-05
Tihiy_Don_29;С давних пор велось так: если по дороге на Миллерово ехал казак один, без товарищей, то стоило ему при встрече с украинцами (слободы их начинались от ;0.010878228629898163
Tihiy_Don_28;Григорий с женой выехали пахать за три дня до покрова. Пантелей Прокофьевич прихворнул: опираясь на костыль, охая от боли, ломавшей поясницу, вышел пр;0.00021971313412711793
Tihiy_Don_232;Ранней весною, когда сойдет снег и подсохнет полегшая на зиму трава, в степи начинаются весенние палы. Потоками струится подгоняемый ветром огонь, жад;0.00013305031917869339
Tihiy_Don_136;"Далеко за Доном - время перевалило уже за обед - пулемет глухо выщелкал две очереди и смолк.
Через полчаса Григорий, не отходивший от окна в горнице, ";9.45062835312047e-05
Tihiy_Don_88;Теплилась осень. Перепадали дожди. Над Быховом редко показывалось обескровленное солнце. В октябре начался отлет дикой птицы. Даже ночами звенел над п;0.00010474955330239649
Tihiy_Don_37;Сотник Евгений Листницкий служил в лейб-гвардии Атаманском полку. На офицерских скачках разбился, переломил в предплечье левую руку. После лазарета вз;0.00016312048992085995
Tihiy_Don_58;В первых числах августа сотник Евгений Листницкий решил перевестись из лейб-гвардии Атаманского полка в какой-либо казачий армейский полк. Он подал ра;0.00301648855485001
Tihiy_Don_186;Верхнедонское восстание, оттянувшее с Южного фронта значительное количество красных войск, позволило командованию Донской армии не только свободно про;7.674494389420676e-06
Tihiy_Don_7;"Аксинью выдали за Степана семнадцати лет. Взяли ее с хутора Дубровки, с той стороны Дона, с песков.
За год до выдачи осенью пахала она в степи, верст ";0.0005875136306896264
Tihiy_Don_76;Первую бригаду одной из пехотных дивизий, находившуюся в резерве Юго-Западного фронта, с приданным к ней 27-м Донским казачьим полком, перед Февральск;2.802610163880512e-05
Tihiy_Don_65;Вагон мягко покачивает, перестук колес убаюкивающе сонлив, от фонаря до половины лавки желтая вязь света. Так хорошо вытянуться во весь рост и лежать ;0.040565939416506464
Tihiy_Don_109;В марте Бунчук был послан на работу в Революционный трибунал при Донском ревкоме. Высокий, тусклоглазый, испитой от работы и бессонных ночей, председа;0.00015046869375784968
Tihiy_Don_102;Слепяще-яркий снеговой хребет бугра, облитый глазурью солнца и синью безоблачного дня, белел, сахарно искрился. Под ним пестрым лоскутным одеялом лежа;4.972063448097215e-05
Tihiy_Don_183;Двое суток прожили они как во сне, перепутав дни и ночи, забыв об окружающем. Иногда Григорий просыпался после короткого дурманящего сна и видел в пол;0.0005086179801113934
Tihiy_Don_154;На заре разведка, посланная к Красному яру, вернулась с известием, что красных не обнаружено до Еланской грани и что Петро Мелехов с десятью казаками ;0.00084024086072189
Tihiy_Don_221;-Дуняшка поднялась рано - надо было доить корову. В кухне осторожно ходил, покашливал Григорий. Прикрыв детишек одеялом, Дуняшка проворно оделась, вош;5.7929183652473214e-05
Tihiy_Don_181;За день на левую сторону Дона были переброшены все повстанческие части и беженцы. Последними переправлялись конные сотни Вешенского полка 1-й дивизии ;5.746117380062485e-06
Tihiy_Don_104;После того как калединцы потрепали революционные казачьи части, Донской ревком, вынужденный перебраться в Миллерово, отправил на имя руководителя боев;0.0012939224193556503
Tihiy_Don_162;Наутро, проснувшись, Григорий вспомнил разговор с Ермаковым и Медведевым. Он не был ночью уж настолько пьян и без особого напряжения восстановил в пам;0.0005544078295104354
Tihiy_Don_67;"К глазной лечебнице доктора Снегирева примыкал маленький садик.
Таких неуютных стриженых садов много по окраинным переулкам Москвы, в них не отдыхает ";0.00022162822169418406
Tihiy_Don_207;Четырнадцать изловленных дезертиров ждали суда. Суд был короткий и немилостивый. Престарелый есаул, председательствовавший на заседаниях, спрашивал у ;0.0003350854291745987
Tihiy_Don_35;Аксинья отстряпалась рано, загребла жар, закутала трубу и, перемыв посуду, выглянула в оконце, глядевшее на баз. Степан стоял возле слег, сложенных ко;0.005417699508613942
Tihiy_Don_212;Дни потянулись серые и безрадостные. Оставив Аксинью, Григорий сразу утратил интерес к окружающему. С утра садился в сани, ехал по раскинувшейся бескр;9.924327326385616e-05
Tihiy_Don_194;"Бой шел на подступах к станице Усть-Медведицкой. Глухой орудийный гул заслышал Григорий, выбравшись с летника на Гетманский шлях.
Всюду по шляху видне";6.885887287146507e-05
Tihiy_Don_214;Соленый, густой, холодный ветер дул с моря. Запах неведомых чужих земель нес он к берегу. Но для донцов не только ветер - все было чужое, неродное в э;0.0013794102158596919
Tihiy_Don_164;И еще в одном бою под Климовкой довелось участвовать Григорию. К полудню около крайних дворов завязалась перестрелка. Спустя немного в Климовку сошли ;0.000233154156235101
Tihiy_Don_196;Казачьи сотни четвертый раз вставали из неглубоких окопов и под убийственным пулеметным огнем красных залегали снова. Красноармейские батареи, укрытые;0.0004022595075345783
Tihiy_Don_128;"Неподалеку от станицы Дурновской Вешенский полк в первый раз ввязался в бой с отступавшими частями красноармейцев.
Сотня под командой Григория Мелехов";1.564448824775193e-05
Tihiy_Don_140;В конце января Иван Алексеевич выехал в Вешенскую по вызову председателя окружного ревкома. К вечеру он должен был вернуться. Его ждали. Мишка сидел в;9.862765968635685e-05
Tihiy_Don_21;"За невестой в поезжанье нарядили четыре пароконные подводы. По-праздничному нарядные люди толпились на мелеховском базу возле бричек.
Дружко - Петро -";0.0019105880301116633
Tihiy_Don_170;Григорий Мелехов пять суток прожил в Татарском, за это время посеял себе и теще несколько десятин хлеба, а потом, как только из сотни пришел исхудавши;0.00010870150405979307
Tihiy_Don_12;"Оставалось полторы недели до прихода казаков из лагерей.
Аксинья неистовствовала в поздней горькой своей любви. Несмотря на угрозы отца, Григорий, тая";0.0016181058388263162
Tihiy_Don_30;Зима легла не сразу. После покрова стаял выпавший снег, и табуны снова выгнали на подножный. С неделю тянул южный ветер, теплело, отходила земля, ярко;8.906096794973736e-05
Tihiy_Don_24;"Сергей Платонович Мохов издалека ведет свою родословную.
В годы царствования Петра I шла однажды в Азов по Дону государева баржа с сухарями и огнестре";7.385500153933707e-05
Tihiy_Don_110;За приречными вербами разноголосо гомонили лягушки. За бугром валилось через порог солнце. По хутору Сетракову рассасывалась предвечерняя прохлада. От;3.938406443140107e-05
Tihiy_Don_84;"Уже 29 августа из телеграмм, получаемых от Крымова, Корнилову стало ясно, что дело вооруженного переворота погибло.
В два пополудни в Ставку прибыл от";0.008818388897328378
Tihiy_Don_168;"12 апреля 1-й Московский полк был жестоко потрепан в бою с повстанцами под хутором Антоновом Еланской станицы.
Плохо зная местность, красноармейские ц";0.00019685256731962923
Tihiy_Don_131;В конце ноября в Новочеркасске стало известно о прибытии военной миссии держав Согласия. По городу пошли упорные слухи о том, что мощная английская эс;0.00011136927394928255
