name;short_text;prob2_0
Tihiy_Don_219;Вместе с Кириллом Громовым скрылись Ахваткин и тот незнакомый казак, которого видел Кошевой, когда пришел к Громовым. В ночь еще двое казаков исчезли ;9.271588081013752e-05
Tihiy_Don_133;Пугающие тишиной, короткие дни под исход казались большими, как в страдную пору. Полегли хутора глухой целинной степью. Будто вымерло все Обдонье, буд;6.993248119574543e-05
Tihiy_Don_180;Дорога по Большому Громку в одном месте шла мимо огорожи, сложенной из серого камня-плитняка, а потом круто заворачивала к Дону, спускалась в неглубок;7.014932098757411e-06
Tihiy_Don_134;В Вешенской на заборах трепыхались фоминские приказы. С часу на час ждали прихода красных войск. А в Каргинской, в тридцати пяти верстах от Вешенской,;0.0022282603727686104
Tihiy_Don_8;За два дня до троицы хуторские делили луг. На дележ ходил Пантелей Прокофьевич. Пришел оттуда в обед, кряхтя скинул чирики и, смачно почесывая натруже;0.001222824541749675
Tihiy_Don_150;В Татарском в день приезда Григория уже сформировались две сотни казаков. На сходе постановили мобилизовать всех способных носить оружие, от шестнадца;0.0003836243035497293
Tihiy_Don_155;Приказом командующего объединенными повстанческими силами Верхнего Дона Григорий Мелехов назначен был командиром Вешенского полка. Десять сотен казако;0.0012443510979772148
Tihiy_Don_163;Степным всепожирающим палом взбушевало восстание. Вокруг непокорных станиц сомкнулось стальное кольцо фронтов. Тень обреченности тавром лежала на людя;0.0012149978301093792
Tihiy_Don_77;Через сутки полк был уже неподалеку от фронта. На узловой станции эшелоны остановили. Вахмистры разнесли приказ: «Выгружаться!» Торопливо сводили каза;0.0007116310997239184
Tihiy_Don_60;"Вместе со второй очередью ушла и третья. Станицы, хутора на Дону обезлюдели, будто на покос, на страду вышла вся Донщина.
На границах горькая разгорал";0.0027220609326077568
Tihiy_Don_152;Из-за Дона, с верховьев, со всех краев шли вести о широком разливе восстания. Поднялось уже не два станичных юрта. Шумилинская, Казанская, Мигулинская;8.8721634117548e-05
Tihiy_Don_34;Наутро Григорий отправился к Мохову в дом. Сергей Платонович пришел из магазина к чаю. Сидел с Атепиным в столовой, оклеенной дорогими, под дуб, обоям;0.008461560450460967
Tihiy_Don_200;Стремительно преследуя отступавшего от Усть-Медведицкой противника, объединенные части Донской армии и верхнедонских повстанцев шли на север. Под хуто;6.275489004514309e-05
Tihiy_Don_224;Поздней осенью 1920 года, когда в связи с плохим поступлением хлеба по продразверстке были созданы продовольственные отряды, среди казачьего населения;2.17243059226011e-05
Tihiy_Don_48;На площади серая густела толпа. В рядах - лошади, казачья справа, мундиры с разными номерами погонов. На голову выше армейцев-казаков, как гуси голлан;0.0008415069571178058
Tihiy_Don_157;Весна отворяла жилы рек. Ядренее становились дни, звучнее нагорные зеленые потоки. Солнце приметно порыжело, слиняла на нем немощно-желтая окраска. Ос;0.00018346984781154738
Tihiy_Don_174;Двадцать пять коммунистов, выданных повстанцам Сердобским полком, под усиленным конвоем выступили из Усть-Хоперской. О побеге нельзя было и думать. Ив;3.1401418831447226e-05
Tihiy_Don_47;Над степью - желтый солнечный зной. Желтой пылью дымятся нескошенные вызревшие заливы пшеницы. К частям косилки не притронуться рукой. Вверх не поднят;0.011988687817515583
Tihiy_Don_122;С Дона через Украину катились красные составы вагонов, увозя в Германию пшеничную муку, яйца, масло, быков. На площадках стояли немцы в бескозырках, в;3.7369221209515394e-06
Tihiy_Don_23;Коршуновы приехали уже после того, как жениха с невестой увезли в церковь. Пантелей Прокофьевич до этого выходил за ворота, взглядывался вдоль улицы, ;0.0002064458033477198
Tihiy_Don_142;Вокруг хуторского ревкома сгруппировалось несколько человек: Давыдка-вальцовщик, Тимофей, бывший моховский кучер Емельян и рябой чеботарь Филька. На н;2.571313539096034e-05
Tihiy_Don_206;Мелеховская семья за один год убавилась наполовину. Прав был Пантелей Прокофьевич, сказав однажды, что смерть возлюбила их курень. Не успели похоронит;9.871309423867336e-06
Tihiy_Don_229;В конце апреля ночью они переправились на баркасе через Дон. В Рубежном у берега их поджидал молодой казак с хутора Нижне-Кривского Кошелев Александр.;3.548266698893756e-05
Tihiy_Don_64;Ярко, до слепящей боли, вспомнилась Григорию та ночь. Он очнулся перед рассветом, повел руками, натыкаясь на колючее жнивье, и застонал от садной боли;0.0009805138568799335
Tihiy_Don_166;В Татарском было пусто и скучно без казаков. Пешая сотня татарцев на время была придана одному из полков 5-й дивизии, переброшена на левую сторону Дон;1.5824941336800219e-06
Tihiy_Don_220;На станции Миллерово Григорию - как демобилизованному красному командиру - предоставили обывательскую подводу. По пути к дому он в каждой украинской с;1.4669364281439494e-05
Tihiy_Don_14;- …Тоскую по нем, родная бабунюшка. На своих глазыньках сохну. Не успеваю юбку ушивать - что ни день, то шире становится… Пройдет мимо база, а у меня ;0.0007058281209643354
Tihiy_Don_106;Шестнадцатого января вечером Бунчук и Анна приехали в Воронеж. Пробыли там два дня и выехали на Миллерово, так как в день отъезда были получены вести,;0.003453683288915868
Tihiy_Don_94;В течение четырех дней с утра до вечера Бунчук занимался с рабочими, присланными в его распоряжение комитетом партии. Их было шестнадцать. Люди самых ;0.0001270009486472612
Tihiy_Don_177;8-я и 9-я красные армии, не смогшие до начала весеннего паводка сломить сопротивление частей Донской армии и продвинуться за Донец, все еще пытались н;0.00011460519896189041
Tihiy_Don_208;17 сентября части ударной группы Шорина, сделав тридцативерстный переход, вплотную подошли к Дону. С утра 18-го красные батареи загремели от устья Мед;0.0004658042690578849
Tihiy_Don_32;"Вечером у косой Лукешки в половине Штокмана собирался разный люд; приходил Христоня, с мельницы Валет в накинутом на плечи замасленном пиджаке; скалоз";0.0005378941294382943
Tihiy_Don_132;Враждебность, незримой бороздой разделившая офицеров и казаков еще в дни империалистической войны, к осени 1918 года приняла размеры неслыханные. В ко;0.0026779509236910795
Tihiy_Don_9;От троицы только и осталось по хуторским дворам: сухой чабрец, рассыпанный на полах, пыль мятых листьев да морщиненная, отжившая зелень срубленных дуб;0.000297833215445361
Tihiy_Don_116;Несколько дней экспедиция шла в глубь Донецкого округа, прорываясь к Краснокутской станице. Население украинских слобод встречало отряд с неизменным р;2.685063269398645e-05
Tihiy_Don_89;Полк отступал вторые сутки. Медленно, с боями, но отступал. По возвышенным грунтовым дорогам тянулись обозы русской и румынской армий. Объединенные ав;2.5836243678427627e-05
Tihiy_Don_44;"К просторному суходолу наростом прилипло имение Листницкого - Ягодное. Меняясь, дул ветер то с юга, то с севера; плыло в синеватой белизне неба солнце";0.0002363750334796906
Tihiy_Don_138;Фронт прошел. Отгремели боевые деньки. В последний день пулеметчики 13-го кавполка перед уходом поставили на широкоспинные тавричанские сани моховский;0.0002554090805384539
Tihiy_Don_10;"Не лазоревым алым цветом, а собачьей бесилой, дурнопьяном придорожным цветет поздняя бабья любовь.
С лугового покоса переродилась Аксинья. Будто кто о";0.0017656744742376622
Tihiy_Don_4;К вечеру собралась гроза. Над хутором стала бурая туча. Дон, взлохмаченный ветром, кидал на берега гребнистые частые волны. За левадами палила небо су;0.0013302558591186946
Tihiy_Don_125;Во время ледяного похода Евгений Листницкий был ранен два раза: первый раз - в бою за овладение станицей Усть-Лабинской, второй - при штурме Екатерино;3.913381362675909e-05
Tihiy_Don_112;После ухода Кошевого казаки сидели некоторое время молча. Над хутором шатался набатный гуд, мелко дребезжали оконца хаты. Иван Алексеевич смотрел в ок;3.076349528254971e-05
Tihiy_Don_81;6 августа начальник штаба верховного главнокомандующего генерал Лукомский, через первого генерал-квартирмейстера Ставки генерала Романовского, получил;0.00033965852508540024
Tihiy_Don_139;Казакует по родимой степи восточный ветер. Лога позанесло снегом. Падины и яры сровняло. Нет ни дорог, ни тропок. Кругом, наперекрест, прилизанная вет;1.7363628278906622e-05
Tihiy_Don_187;"В эту ночь около хутора Малого Громчонка полк красноармейцев переправился через Дон на сбитых из досок и бревен плотах.
Громковская сотня была застигн";1.108902198150219e-05
Tihiy_Don_5;До хутора Сетракова - места лагерного сбора - шестьдесят верст. Петро Мелехов и Астахов Степан ехали на одной бричке. С ними еще трое казаков-хуторян:;0.0032232624072688273
Tihiy_Don_96;"Шесть дней под Ростовом и в самом Ростове шли бои.
Дрались на улицах и перекрестках. Два раза красногвардейцы сдавали Ростовский вокзал и оба раза выб";0.008651990622972141
Tihiy_Don_22;"Отдохнувшие у Коршуновых лошади шли, добираясь до мелеховского база, из последних сил. На ременных шлеях, стекая, клубилась пена.
Подвыпившие кучера г";0.012041399477080056
Tihiy_Don_215;С юга двое суток дул теплый ветер. Сошел последний снег на полях. Отгремели пенистые вешние ручьи, отыграли степные лога и речки. На заре третьего дня;9.187723344213835e-06
Tihiy_Don_158;Полой водой взбугрилось и разлилось восстание, затопило все Обдонье, задонские степные края на четыреста верст в окружности. Двадцать пять тысяч казак;4.6588893419939e-06
Tihiy_Don_45;В марте 1914 года в ростепельный веселый день пришла Наталья к свекру. Пантелей Прокофьевич заплетал пушистым сизым хворостом разломанный бугаем плете;7.31803476807792e-06
Tihiy_Don_216;К лету в Татарский возвратилось десятка три казаков из числа ходивших в отступление. В большинстве своем это были старики и служивые старших возрастов;4.381326681780642e-05
Tihiy_Don_11;За хутором Сетраковым в степи рядами вытянулись повозки с брезентовыми будками. Невидимо быстро вырос городок, белокрыший и аккуратный, с прямыми улоч;0.004556214737269573
Tihiy_Don_161;Станица Каргинская стала опорным пунктом для 1-й повстанческой дивизии. Григорий Мелехов, прекрасно учитывая стратегическую выгодность позиции под Кар;2.9267017233198514e-05
Tihiy_Don_13;С того дня, как приезжала баба Томилина, подурнел Степан с лица. Висли на глаза брови, ложбинка глубокая и черствая косо прорезала лоб. Он мало говори;0.0027277890825030964
Tihiy_Don_3;"Григорий пришел с игрищ после первых кочетов. Из сенцев пахнуло на него запахом перекисших хмелин и пряной сухменью богородицыной травки.
На цыпочках ";0.000502790974673199
Tihiy_Don_20;"Всходит остролистая зеленая пшеница, растет; через полтора месяца грач хоронится в ней с головой, и не видно; сосет из земли соки, выколосится; потом ";0.0035696483727587196
Tihiy_Don_115;Эти дни он жил, как в тифозном бреду. Ходил, делал что-то, ел, спал, но все это словно в полусне, одуряющем и дурманном. Ошалелыми припухлыми глазами ;9.522641746871974e-05
Tihiy_Don_39;"У Штокмана стали собираться реже. Подходила весна. Хуторцы готовились к весенней работе; лишь с мельницы приходили Валет с Давыдкой и машинист Иван Ал";0.0003896858192680111
Tihiy_Don_126;Вызрел ковыль. Степь на многие версты оделась колышущимся серебром. Ветер упруго приминал его, наплывая, шершавил, бугрил, гнал то к югу, то к западу ;0.0001083039693235863
Tihiy_Don_43;На шестом месяце, когда скрывать беременность было уже нельзя, Аксинья призналась Григорию. Она скрывала, боясь, что Григорий не поверит в то, что его;0.0027038562065064865
Tihiy_Don_204;"Небо заволокло тучами. Накрапывал мелкий, будто сквозь сито сеянный, дождь. Молодая отава, бурьяны, раскиданные по степи кусты дикого терна блестели.
";7.592302858333741e-05
Tihiy_Don_129;И после, когда полк вступил в полосу непрерывных боев, когда вместо завес уже лег изломистой вилюжиной фронт, Григорий всегда, сталкиваясь с неприятел;2.0962706922471692e-05
Tihiy_Don_73;Сбочь хутора Татарского, по небу, изморщенному седой облачной рябью, колесило осеннее солнце. Там, вверху, тихий ветерок лишь слегка подталкивал тучи,;1.687294805688713e-05
Tihiy_Don_197;Дня через три после отъезда Григория явился в хутор Татарский Митька Коршунов. Приехал он не один, его сопровождали двое сослуживцев по карательному о;7.2315849847958934e-06
Tihiy_Don_151;В Вешенской к красному кирпичному зданию исполкома резво подкатила тачанка, конвоируемая двумя конными казаками. В задке полулежал Лихачев. Он встал, ;0.004290819164558005
Tihiy_Don_31;Пантелей Прокофьевич вернулся со схода и прямо прошел в боковушку, комнату, которую он занимал со старухой. Ильинична эти дни прихварывала. На водянис;0.0006429160597118937
Tihiy_Don_99;За окном вагона рябила метель. Над полуразрушенным частоколом щитов виднелись прилизанные ветром, затвердевшие сугробы. Изломистые крыши их были причу;2.6646104224443107e-05
Tihiy_Don_190;Под командованием генерала Секретева трехтысячная конная группа Донской армии при шести конных орудиях и восемнадцати вьючных пулеметах 10 июня сокруш;0.0005694667353696941
Tihiy_Don_147;На второй день после приезда с Сингина Кошевой отправился в Вешенскую узнать, когда будет собрание комячейки. Он, Иван Алексеевич, Емельян, Давыдка и ;0.0029222308612324574
Tihiy_Don_156;Из Каргинской Григорий повел на Боковскую уже три с половиной тысячи сабель. Вдогон ему штаб и окрисполком слали нарочными приказы и распоряжения. Оди;0.0001273188807238882
Tihiy_Don_82;За день до приезда Корнилова в Москву есаул Листницкий прибыл туда с поручением особой важности от Совета союза казачьих войск. Передав в штаб находив;0.0002495924367113587
Tihiy_Don_127;"По линии Филоново - Поворино выравнивался фронт. Красные стягивали силы, копили кулак для удара. Казаки вяло развивали наступление; испытывая острую н";3.1257726407504835e-05
Tihiy_Don_93;Изжелта-белые, грудастые, как струги, тихо проплывали над Новочеркасском облака. В вышней заоблачной синеве, прямо над сияющим куполом собора, недвижн;0.00028085459823801103
Tihiy_Don_18;Коршуновы слыли первыми богачами в хуторе Татарском. Четырнадцать пар быков, косяк лошадей, матки с Провальских заводов, полтора десятка коров, пропас;0.0001628860699280331
Tihiy_Don_83;В версте от развалин местечка, стертого орудийным огнем июньских боев, возле леса причудливо вилюжились зигзаги окопов. Участок у самой опушки занимал;5.682224289380605e-06
Tihiy_Don_202;Многое передумал и вспомнил Григорий за двое суток пути от фронта до родного хутора… Чтобы не оставаться в степи одному со своим горем, с неотступными;0.00024007779281055817
Tihiy_Don_184;Через два дня Григорий возвратился из поездки по фронту своей дивизии. Штаб командующего перебрался в хутор Черный. Григорий около Вешенской дал коню ;0.0004762849596193111
Tihiy_Don_189;Каждый день Ильинична просыпалась чуть свет, доила корову и начинала стряпаться. Печь в доме не топила, а разводила огонь в летней кухне, готовила обе;3.6917437619146025e-05
Tihiy_Don_105;"Черные глаза Анны, блещущие слезами и улыбкой, увидел Бунчук, как только в первый раз открыл глаза.
Три недели был он в бредовом беспамятстве. Три нед";0.0027784587335324927
Tihiy_Don_101;Перед съездом фронтового казачества в Каменской бежал из полка подъесаул Изварин. Накануне он был у Григория, говорил, отдаленно намекая на свой уход:;5.278905873795418e-05
Tihiy_Don_217;В хуторе стали поговаривать о Кошевом и Дуняшке. Одна из баб, встретив как-то Дуняшку на пристани, спросила с откровенной издевкой: «Аль наняла Михаил;8.491867111653593e-06
Tihiy_Don_148;В кизячнике густо пахнет сухим навозом, выпревшей соломой, объедьями сена. Сквозь чакановую крышу днем сочится серый свет. В хворостяные ворота, как с;0.00020038457960167656
